,ID,is_Original,Flair,num_comments,Title,Subreddit,Body,URL,Upvotes,Comments,creation_date
0,6fphas,False,[r/all],966,Some words from Maisie Williams,Feminism,,https://i.redd.it/ka0kgautv32z.jpg,10022,"Agreed, if your not for equal rights of men and women you are sexist, but we can’t act like we’re apart of an unpopular opinion. ",2017-06-06 23:01:05
1,79osxd,False,[r/all],385,This sadly happens all to often.,Feminism,,https://i.imgur.com/0lLo035.jpg,5988,[removed] ,2017-10-30 16:23:35
2,ao1xoz,False,[Abortion rights],179,Religious bigots are just monsters.,Feminism,,https://i.redd.it/5abqqj1454f21.jpg,4398,[removed] ,2019-02-07 09:13:22
3,8e6c84,False,None,178,"This can never go away, this needs to continue to get posted over and over and over again. This should never be forgotten",Feminism,,https://i.redd.it/ar0tu4fi2jt01.jpg,3957,This reminds me so much of when Steve carrel talks about touching a boob in 40 year old virgin. If in that movie his character had been a sleazy rich douche bag instead of an endearing TV salesman this is exactly what he would’ve said ,2018-04-22 21:25:44
4,aytt2d,False,None,300,Abortion,Feminism,,https://i.redd.it/rt9nobfpyxk21.jpg,3764,[removed] ,2019-03-08 18:51:34
5,gvwgo7,False,None,97,Breonna Taylor was shot and killed in her SLEEP months ago and the officers are still on the job! George Floyd’s murderer was arrested and charged within days. Are black women going to get justice too? We have to focus our attention and efforts on this now. Where are the feminists at on this case?!,Feminism,,https://i.redd.it/7zcp4qjpvp251.jpg,3756,[removed] ,2020-06-03 15:52:40
6,a1cqk0,False,None,264,About abortion,Feminism,,https://i.redd.it/k4at3i36c6121.jpg,3741,[removed] ,2018-11-29 01:38:36
7,d43w92,False,None,140,Hi i know this is a repost but i feel like there is a long time since i saw this post.. so here is a reminder,Feminism,,https://i.redd.it/gg1nd3dtmjm31.jpg,3722,[removed] ,2019-09-14 11:17:04
8,e4h48l,False,None,118,This is one way you can be an ally 👏,Feminism,,https://i.redd.it/hyhusccjr0241.jpg,3702,[removed] ,2019-12-01 12:55:50
9,bw84x0,False,None,188,"Brock ""The Rapist"" Turner",Feminism,,https://i.redd.it/b018ml8ul3231.jpg,3624,I hate stories like this. He clearly has problems but didn’t get help and so he ended doing the unthinkable and hurting someone in the most disgusting way. I wish as a society we would focus on mental health more and then maybe we could stop these things before they happen rather than seeking punishment for something that already happened ,2019-06-03 08:00:29
10,fj5qem,False,None,63,Happy 87th Birthday to the legendary RBG,Feminism,,https://i.redd.it/5sg9lz9qovm41.jpg,3494,Cool that she chose to endanger the reproductive rights of women and the right to safety and security of immigrant women by continuing to sit on the Supreme Court rather than stepping down when we had a Democratic president ,2020-03-15 18:18:00
11,am3r54,False,None,79,Marriage and Feminism,Feminism,,https://i.redd.it/06snlkwwgzd21.jpg,3471,[removed] ,2019-02-01 16:26:30
12,bygszg,False,None,203,Bennyboy gets rekt with facts and logic,Feminism,,https://imgur.com/f6AYIRA.jpeg,3344,r/wokekids ,2019-06-09 04:56:44
13,bnp0rm,False,None,127,"Not sure if this has been shared yet, but it asks a really good question.",Feminism,,https://imgur.com/off6Jq2,3334,[removed] ,2019-05-12 13:36:34
14,fru5fa,False,None,88,I Believe You,Feminism,,https://i.redd.it/53nsyfsv8pp41.jpg,3233,Yea they existed its their fault. Typical ,2020-03-30 16:38:20
15,e870y8,False,None,57,"As your kids start school again, tell them about Ruby Bridges 👏",Feminism,,https://i.redd.it/m3syqeyxdk341.jpg,3190,What does this have to do with feminism? ,2019-12-09 07:59:25
16,escrls,False,None,153,"The link between guns, police and violence against women in America",Feminism,,https://i.redd.it/lhz5uw1bccc41.jpg,3127,[deleted] ,2020-01-22 14:33:57
17,f0tjtf,False,None,95,A privileged female rape cheerleader,Feminism,,https://i.redd.it/teuz1j1t4qf41.jpg,3117,[deleted] ,2020-02-08 16:08:32
18,fovxn8,False,None,45,Two Brazilian women scientists sequenced the genome of the coronavirus in record time -- just 2 days after the 1st case appeared in Brazil. They used experience & technology from their studies of the Zika virus to make it happen.,Feminism,,https://i.redd.it/1jlpps229vo41.jpg,3044,[removed] ,2020-03-25 18:58:30
19,f967ro,False,None,139,The enemy of feminism isn't men,Feminism,,https://i.redd.it/n6w7rum5o0j41.jpg,3030,[removed] ,2020-02-25 06:47:10
20,bea21w,False,None,231,Dad of the year!,Feminism,,https://i.redd.it/fwregzvxsus21.jpg,3023,[deleted] ,2019-04-17 16:47:00
21,ho6dmz,False,None,55,They were asking for it,Feminism,,https://i.redd.it/0va12zd01v951.jpg,3014,[removed] ,2020-07-09 16:40:08
22,9mz2sc,False,None,230,Got this on my feed today.,Feminism,,https://i.redd.it/n6pmoifdscr11.jpg,2962,[deleted] ,2018-10-10 12:38:46
23,crxr7d,False,None,119,Hmmmmm,Feminism,,https://i.redd.it/evnbvoopg5h31.jpg,2960,[removed] ,2019-08-18 06:17:16
24,h0e6xq,False,None,76,This belongs here.,Feminism,,https://i.redd.it/4a29utamkz351.jpg,2951,[removed] ,2020-06-10 16:19:42
25,dx3554,False,None,350,The accuracy hurts,Feminism,,https://i.redd.it/sd5xu3c1pzy31.jpg,2922,[removed] ,2019-11-16 06:07:45
26,amq462,False,[Satire/Humor],234,If the message was the same for men...,Feminism,,https://i.redd.it/ygyweo0h8de21.jpg,2916,Fake news ,2019-02-03 14:44:04
27,cf7va7,False,None,212,"Pedophilia and ""Maturity"" myth.",Feminism,,https://i.redd.it/y4vgkkgen9b31.jpg,2877,[removed] ,2019-07-19 13:57:08
28,d1evy7,False,None,226,This ain't it chief,Feminism,,https://i.redd.it/0pj93kiuzel31.jpg,2859,[removed] ,2019-09-08 18:37:06
29,eokzyh,False,None,140,When random online males suffer from correctile dysfunction ...,Feminism,,https://i.redd.it/s665q0d4tqa41.jpg,2832,[removed] ,2020-01-14 13:04:08
30,9mqslz,False,None,403,Accusations ruin a man's life.,Feminism,,https://i.redd.it/tghq42o8v6r11.jpg,2815,[removed] ,2018-10-09 16:44:10
31,er6n95,False,None,95,Just a reminder,Feminism,,https://i.redd.it/xv44imwfiub41.jpg,2793,"Something that is never talked because to be frank different feminists take stances on this topic depending on what most readily benefits them. If you talk about men discriminating against women based on appearances some women will take it to mean you are saying they didn't earn where they got even if that isn't what people are saying at all, and if you flip it than it starts to draw a line of who fits into a male gaze beauty standard and who doesn't even though that is completely subjective and varies wildly even city to city so the whole discussion divulges into divisive isolationism. ",2020-01-20 02:35:30
32,e64hor,False,None,77,"it’s in a book, just take a look, drake’s a creeper",Feminism,,https://i.redd.it/zxwl9udo5o241.jpg,2784,Ngl I’m still gonna bump drake. Money in the grave goes to hard ,2019-12-04 19:36:04
33,gajmbx,False,None,144,A common misconception...,Feminism,,https://i.redd.it/fosy147r5uv41.jpg,2747,"Honest Question, do you all think all this virtue signaling is actually going to effect men’s behavior? 

I’d argue this woman is pretty clueless about men’s motivations. 

Men are of course capable of these things, but since being ignorant benefits them, they will deliberately choose ignorance no matter how much you attempt to “educate” them. ",2020-04-29 22:47:05
34,b4lxc9,False,None,161,"This can never go away, this needs to continue to get posted over and over and over again, This should never be forgotten",Feminism,,https://i.redd.it/quhctdg3own21.jpg,2740,Didn’t Hillary refer to black people as super predators?  Is that OK? ,2019-03-23 17:43:12
35,5pcn73,False,[r/all],164,Trump Inauguration (top) vs. Women's March (bottom),Feminism,,http://i.imgur.com/ivzyXdP.png,2720,[removed] ,2017-01-21 20:20:23
36,evo7lc,False,None,94,Transmisogyny,Feminism,,https://i.redd.it/wm0pjubxiqd41.jpg,2716,[removed] ,2020-01-29 15:19:24
37,a9dqm2,False,None,151,All that money wasted ... but... you know... gotta resolve those false dilemmas.,Feminism,,https://i.imgur.com/qqm2IPs.jpg,2666,"Is it really one or the other? This was a celebration of the work of an amazing woman and installed as a monument to her as a practical art installation in Melbourne Australia. I think it’s also nice to see women represented (despite women not needing to wear a dress etc) in practical scenarios. Sure let’s not be raped or abused or paid less but I feel like that shouldn’t come and the expense of celebrating the contribution of fantastic ladies!

Edit: I see that this is a different one to the one I’m talking about, mine had an awesome bonnet.  ",2018-12-25 09:45:39
38,7mu0r9,False,[Sexual harassment],96,Terry Crews: “men need to hold other men accountable”,Feminism,,http://time.com/5049671/terry-crews-interview-transcript-person-of-the-year-2017/,2658,[deleted] ,2017-12-29 12:22:41
39,d8lxld,False,None,65,All hail Greta,Feminism,,https://i.redd.it/b078ioe64io31.jpg,2647,[removed] ,2019-09-24 11:39:10
40,en73f5,False,None,280,Husband Stitch -- a form of genital mutilation perpetuated (by males) against women.,Feminism,,https://i.redd.it/hxo5caovc5a41.jpg,2636,[removed] ,2020-01-11 12:55:42
41,dcdzec,False,None,260,I hate getting this question,Feminism,,https://imgur.com/yEFq84x,2636,[removed] ,2019-10-02 18:09:15
42,br7475,False,None,268,Abortion,Feminism,,https://i.redd.it/5n56idmehiz21.jpg,2605,[removed] ,2019-05-21 06:49:54
43,cnirwr,False,None,329,Their shouldn't be any billionaires,Feminism,,https://i.redd.it/9k7geiqeq6f31.jpg,2587,"The heck. This is based on a poor understanding of economics. Money can be created or destroyed at will by federal reserve banks. So you can't ""run out of money"" by having people earn more. 

&#x200B;

In addition, spending money isn't universally ""good"". What, exactly, do you propose people spend their money on? A lot of essential items, like food, are already quite cheap. Others, like housing, do not increase in supply in reponse to increase deman (actually nothing does). In fact most people spend too much any way, especially poor people. Overspending for anyone but the rich incurs debt. And debt destablizes economies. So we really should do more to curb spending. 

&#x200B;

May I blow your mind though? If you look at any inflation adjusted stock index, it has gone up over time. Inflation adjusted meaning this is not explained by increases in money supply. Why is that? Why is it that wealth is created out of thin air? The reason being that econmic growth is not measured by mansions and yachts, but by increased productivity?

&#x200B;

Why do you think everyone can have a car these days? And we can all get medecines? And cell phones? Over time businesses have made these things more available and cheaper to manufacture. That didn't occur without innovation and risk. And the people that took said risk end up billionaires. 

&#x200B;

Here is the thing. Billionaires are a sign of progress. They are a sign that people are rewarded for working harder than the rest. They show that you take an idea, nurture it, and you will reap the benefits. And I get it. It is annoying that people are richer than you, but entertain the thought that they actually deserved some of that. 

&#x200B;

Now I am all for things like providing education for poor people. Doing something about drug companies taking advantage of price inelasticity. And reducing the cost of college. But we need to be sensitive to the actual price indicators and not be emotional and resentful of those that have more than us. 

&#x200B;

Because someone will always have more. Don't focus on them. Focus on yourself. By believing you are disadvantaged, you will be disadvantaged. But most of us, esp. in america, have a ton of potential. And the sooner we realize that, the better we  will all be. ",2019-08-08 08:25:08
44,c22twb,False,None,288,"I only realised today, that this should not be just a woman’s fight. I’m outraged at the men who have said and done nothing to support us.",Feminism,,https://i.redd.it/mwnzl2idj4531.jpg,2561,[removed] ,2019-06-18 14:20:47
45,f486f9,False,None,21,Women NEVER liked the harassment.,Feminism,,https://i.redd.it/szwqlc5wpcb41.jpg,2559,i don’t think men who sexually harass women think they like it they just do it bc they don’t get any sexual attention ,2020-02-15 11:23:11
46,bzvtiw,False,None,70,"Satirical tweet, but this is basically every guy in the Instagram comments of a post about abortion",Feminism,,https://i.redd.it/jxvia2iscz331.jpg,2555,[removed] ,2019-06-12 19:50:51
47,apw6dm,False,None,130,The Lord of the Rings as antidote to toxic masculinity? Sign me the fuck up,Feminism,,https://i.redd.it/mxm6905u84g21.jpg,2557,[deleted] ,2019-02-12 18:02:16
48,dusfhc,False,None,52,An important reminder,Feminism,,https://i.redd.it/4wg069rz72y31.jpg,2554,[removed] ,2019-11-11 13:33:19
49,bphdtl,False,None,510,ATTN: ALL WOMEN IN ALABAMA AND OTHER STATES THREATENING ABORTION RIGHTS (also: WomenOnWeb.org and WomenOnWaves.org will ship you an abortion pill if it is illegal to get an abortion in your country - pass on the information),Feminism,,https://i.redd.it/6remdh3nrjy21.jpg,2527,[removed] ,2019-05-16 20:04:43
50,csg08v,False,None,97,Protest against state-sanctioned misogyny,Feminism,,https://i.redd.it/275zdrh49eh31.jpg,2504,[removed] ,2019-08-19 11:50:46
51,bxy0ff,False,None,179,8 steps to avoid sexual assault,Feminism,,https://i.redd.it/z00c7mr19z231.jpg,2494,... ,2019-06-07 18:25:46
52,9w01kt,False,None,103,"You don’t know jack, Tammy",Feminism,,https://i.imgur.com/jC5tXjV.jpg,2485,"To Tomi Lahren's credit (and literally her only credit), she has stated she's pro choice ",2018-11-11 01:56:41
53,d5cypq,False,None,129,Are you?,Feminism,,https://i.redd.it/a4szljn7k3n31.jpg,2438,[removed] ,2019-09-17 06:18:08
54,agj4wc,False,None,285,This is how reactionary anti-women trolls react to feminism.,Feminism,,https://i.redd.it/iwmj6cc1xqa21.jpg,2427,[removed] ,2019-01-16 08:28:24
55,bt5qjm,False,None,39,It's so realistic!,Feminism,,https://i.redd.it/8te5uoykri031.png,2416,[removed] ,2019-05-26 08:51:17
56,ab9aj1,False,None,115,Happy New Year!,Feminism,,https://i.redd.it/4y8ntf8zgn721.jpg,2390,[removed] ,2018-12-31 17:40:37
57,bf90ud,False,None,34,Physical respect is a right.,Feminism,,https://i.redd.it/syr3xd9dxct21.jpg,2369,"No one thinks that touching people without consent is okay if it is in any way sexual, but tappning somone on the shouldef or arm happens equally to both genders and is equally annoying to respective parties so I think perhaps this one you guys should just drop. ",2019-04-20 05:43:51
58,fjmqrf,False,None,181,The Finnish Government giving an update on Coronavirus measures.,Feminism,,https://i.redd.it/2ptj591jz1n41.jpg,2365,[removed] ,2020-03-16 15:29:18
59,dsdjxr,False,None,148,"For The First Time In History, Girls Won All Five Top Prizes at the Broadcom Masters STEM Competition",Feminism,,https://i.redd.it/gc6j09u431x31.jpg,2349,k ,2019-11-06 08:40:10
60,bkmu53,False,[Media],87,Someone get some ice for that burn.,Feminism,,https://i.redd.it/5ug0am4c08w21.jpg,2348,No or I'm not in the mood is better than I have a headache excuse ,2019-05-04 16:24:00
61,dvlf9a,False,None,72,In a nutshell.....,Feminism,,https://i.redd.it/2jr406euddy31.jpg,2344,[removed] ,2019-11-13 03:06:02
62,dgy7m1,False,None,161,More than mammaries,Feminism,,https://i.redd.it/48rbpitnb5s31.jpg,2338,[removed] ,2019-10-12 17:34:26
63,fnfiyu,False,None,64,On blood,Feminism,,https://i.redd.it/j8rgnqn609n41.png,2321,[removed] ,2020-03-23 06:50:50
64,a93438,False,None,105,"Hail Satan then, I guess",Feminism,,https://i.redd.it/50t6xdgwco521.jpg,2319,[removed] ,2018-12-24 07:58:01
65,9pccsp,False,None,456,I was just banned from r/feminist_videos for not being a terf.....,Feminism,,https://i.redd.it/uczwas17vzs11.jpg,2317,Lol I love seeing the left eat itself ,2018-10-18 19:19:41
66,dyeh4o,False,None,99,That,Feminism,,https://i.redd.it/qpgo4x887kz31.jpg,2306,[removed] ,2019-11-19 03:05:16
67,fn1iza,False,None,20,"A fantastic skilled team of 3 women scientists -- Annalisa Bergna, Arianna Gabrieli and Alessia Lai -- have isolated the Italian strain of Coronavirus and none of them even have tenure.",Feminism,,https://i.redd.it/5kkf1n6pt8o41.jpg,2283,"No one would care if it was three male scientists. This isn't feminism, this is glorifying women for doing their jobs like everyone else. ",2020-03-22 15:33:13
68,ev720h,False,None,104,"All the talk of ""disrespect"" and ""reputation"" is nothing but a smokescreen. They simply do not want women talking about rape. They want to continue the culture of silence.",Feminism,,https://i.redd.it/c18wzlplfjd41.png,2285,The time to talk about rape is immediately following the crime. ,2020-01-28 15:31:27
69,apm4zb,False,None,162,And the biggest Mansplainer award goes to...,Feminism,,https://i.redd.it/h0ul02k8q0g21.jpg,2272,[removed] ,2019-02-11 22:48:47
70,7ynlnp,False,[Sexuality],69,Men Too,Feminism,,https://imgur.com/VdWLwKM,2257,[removed] ,2018-02-19 15:59:01
71,erxev5,False,None,156,Double standards,Feminism,,https://i.redd.it/q6d2rcstw5c41.jpg,2252,[removed] ,2020-01-21 16:55:46
72,ewpn5x,False,None,40,"It's not us, it's you.",Feminism,,https://i.redd.it/medlqfgwl3e41.jpg,2248,[removed] ,2020-01-31 15:00:52
73,9y6tmz,False,None,127,She slays and she knows it.,Feminism,,https://i.redd.it/lcsk5kvmdzy11.jpg,2243,[removed] ,2018-11-18 15:31:52
74,d4zj71,False,None,240,Men Vs. WOMEN,Feminism,,https://i.redd.it/5k80dku62ym31.jpg,2243,[removed] ,2019-09-16 11:48:15
75,gy6ltg,False,None,32,One story out of too many like it.,Feminism,,https://i.imgur.com/i0mGEnM.jpg,2237,"Wtf? I remember hearing the other day a case about a black man who was killed and his body was stuffed with newspaper. And they also ruled that a suicide. Because apparently these people are so delusional that they believe someone can stuff their own body after they die. It’s horrible.

Edit: it was ruled accidental- not suicide. But that doesn’t make it any better. 
[https://www.cnn.com/2013/10/09/us/georgia-gym-mat-death/index.html](https://www.cnn.com/2013/10/09/us/georgia-gym-mat-death/index.html) ",2020-06-07 05:28:51
76,cj910o,False,None,252,Acid Attacks,Feminism,,https://i.redd.it/tt1awem7r7d31.jpg,2230,[removed] ,2019-07-29 09:43:10
77,cilmpq,False,None,60,Say it with us. 💕,Feminism,,https://i.redd.it/ygudjescbwc31.jpg,2227,[removed] ,2019-07-27 19:14:39
78,gv5amo,False,None,56,"When Anna said she was raped by two on-duty cops, she thought it would be a simple case. She had no idea she lived in one of 35 states where officers can claim a detainee consented.",Feminism,,https://www.buzzfeednews.com/article/albertsamaha/this-teenager-accused-two-on-duty-cops-of-rape-she-had-no,2213,[removed] ,2020-06-02 11:03:42
79,dmgz5t,False,None,102,Just a reminder,Feminism,,https://i.imgur.com/Y5JmSFM.jpg,2212,[removed] ,2019-10-24 14:12:43
80,bps81y,False,None,288,But fucking honestly. LEAVE MY BODY THE FUCK ALONE,Feminism,,https://i.redd.it/ytab9nyjbsy21.jpg,2217,[removed] ,2019-05-17 14:50:46
81,gumxw3,False,None,61,"Scientific Sexism: First accurate description of clitoris is just 22 years old. Around 90% of the clitoris’s bulk lies beneath the surface. Beneath the surface, it was 10 times the size most people thought it was & boasted 2 to 3 times as many nerve endings as the penis.",Feminism,,https://i.redd.it/3qbm4fazkb251.jpg,2209,"just makes men look dumber for not being able to ""find"" such a big target lmao ",2020-06-01 15:47:33
82,gn7hrx,False,None,111,"1 in 3 women worldwide have been victims of violence. 38% of all murdered women, are murdered by their partners. 700 million women alive today got married under the age of 18. (London School of Hygiene & Tropical Medicine, 2013)",Feminism,,https://i.redd.it/xgwrfebiqvz41.jpg,2203,[removed] ,2020-05-20 08:21:48
83,cvagme,False,None,23,Protesting Fascism while breastfeeding - What a power move.,Feminism,,https://i.redd.it/twmlv150eki31.jpg,2192,What's this event about? ,2019-08-25 16:16:17
84,b6kk3w,False,[Trigger Warning],408,War Rape,Feminism,,https://i.redd.it/y89ztsz3uvo21.jpg,2182,[removed] ,2019-03-28 15:58:51
85,atjg9g,False,None,43,How to parent a princess,Feminism,,https://i.redd.it/58yxcktna5i21.jpg,2181,[removed] ,2019-02-22 16:18:38
86,gkfe3t,False,None,140,"""...the six videos of my rape stayed up on PornHub for over 6 months, while I begged them daily to remove them? & that more & more ads kept popping up, meaning they were increasingly monetized as the view count rose, ending up with combined totals in the millions...""",Feminism,,https://i.redd.it/g9maqeyi9zy41.jpg,2177,Link to video? ,2020-05-15 19:09:35
87,e8ocxu,False,None,93,"REDO: Amen! (Sorry I cross-posted from a gross sub, please see comments)",Feminism,,https://i.redd.it/a2u6euq6wr341.jpg,2170,[removed] ,2019-12-10 09:14:08
88,dp4j3k,False,None,68,"Be beautiful, be successful, and don't judge a book by its cover.",Feminism,,https://i.redd.it/legemtd0gnv31.jpg,2167,"Those guys are assholes but to be fair no body says I can program code in python, C++, Java, MIPS, objective-C.
The way the headliner has tried to list the techy names makes it sound like they were just trying to make a big list ( after all that’s what we programmers do in our resumes )

So if they just said: and she’s a lead iOS developer, I would be much more impressed than listing language names. ",2019-10-30 09:51:15
89,bgphqo,False,None,72,Saw this going around Facebook for awhile. Thought it’d go good here,Feminism,,https://i.redd.it/7b06oj1on4u21.jpg,2143,[deleted] ,2019-04-24 02:59:23
90,ape683,False,[Abortion rights],116,Irrationality of the pro-forced birth crowds.,Feminism,,https://i.redd.it/2nofoox2fwf21.jpg,2128,[removed] ,2019-02-11 08:19:08
91,9v0g46,False,[Race] [Music],145,The Problem With Iggy,Feminism,,https://i.redd.it/5fglb8rrhxw11.jpg,2132,[removed] ,2018-11-07 15:39:02
92,9jo6zt,False,[Rape culture] [Abortion rights] [Politics],143,Mistakes...,Feminism,,https://i.redd.it/rm9u0uo250p11.jpg,2126,[removed] ,2018-09-28 15:58:31
93,aha9dd,False,None,109,"""NOT ALL MEN""",Feminism,,https://i.redd.it/0ljsmg6kk6b21.jpg,2117,"This is not constructive at all but Joe Rogan’s take on this is disgusting, infuriating, small-minded, and as idiotic as one might expect. It pisses me off *so much* because he has such a large audience, people take what he says as gospel, and no one challenges him. He’s a piece of shit who manages to get 1 out of 100 things almost right.  ",2019-01-18 13:06:58
94,c38jgs,False,None,87,Great to see men standing up for women's rights. We need more of this!,Feminism,,https://i.redd.it/vx2u1b004k531.jpg,2110,His first comment is sexist. ,2019-06-21 09:37:15
95,b24hdk,False,[Disputed content],79,Meritocracy !!!!!!!!!!!!!!!!!!.....................................!!!,Feminism,,https://i.redd.it/ra6v6cxl5om21.jpg,2105,[removed] ,2019-03-17 12:00:47
96,8mb5fw,False,[TW][Rape culture],73,"This can never go away, this needs to continue to get posted over and over and over again. This should never be forgotten",Feminism,,https://i.redditmedia.com/3700LRPGXoordMrWXGrni9_14dA1Smle5UFRJc8ZJn4.jpg?w=789&s=e3aaa444ccf12695e247abf60a025e40,2106,[removed] ,2018-05-26 16:13:16
97,fi4vij,False,None,99,Sorry this is to long. Originally posted on r/wholesomememes,Feminism,,https://i.redd.it/x0yrm457nhm41.jpg,2105,[removed] ,2020-03-13 19:04:29
98,ae578m,False,[Trigger Warning],213,"Rape Cheerleaders and their obsession with ""False Accusation""",Feminism,,https://i.redd.it/mhh7qdtv8d921.jpg,2102,[removed] ,2019-01-09 09:25:44
99,9wbzj6,False,None,45,"This is how Virginia’s newest congresswoman, Abigail Spanberger, gave her victory speech.",Feminism,,https://i.redd.it/ngxbb6w2sux11.jpg,2100,[deleted] ,2018-11-12 07:34:00
100,cg3ea5,False,None,129,Antifeminist Tactics,Feminism,,https://i.redd.it/81ur558zqpb31.jpg,2077,[removed] ,2019-07-21 20:05:41
101,dlx73f,False,None,117,440 pairs of women’s shoes hung on a wall in Istanbul.,Feminism,,https://i.redd.it/dua7infjn9u31.jpg,2075,Isn't Islam the greatest religion ,2019-10-23 10:16:25
102,cuu055,False,None,93,Yes,Feminism,,https://i.redd.it/433s4f96tdi31.jpg,2065,Sounds suspiciously like transphobia too 🤔 ,2019-08-24 14:24:58
103,bshhyb,False,None,80,Interesting how some constitutional rights are prioritized over others,Feminism,,https://i.pinimg.com/originals/6c/9f/98/6c9f98f520d395a7aa5e7fd1c0f96450.jpg,2064,[removed] ,2019-05-24 14:19:48
104,gf0m2h,False,None,114,I saw this and thought it belonged here,Feminism,,https://i.redd.it/86tq5frqv6x41.jpg,2058,"But how many of you support her if she does that to Quran or Bhagavad Gita ? 

You know what...consistency is everything. I know that most of you guys won't support a Hindu or Muslim woman if she dare to defy patriarchal beliefs by burning Bhagavad Gita or Quran? Instead you will brand us racist. More outrageously, you people will do so in the guise of intersectionality. 

So sorry, I can't take you people's ""feminist"" enthusiasm (comment section) very seriously.

People who would have branded her (Hindu or Muslim) a racist, are now downvoting ;-). So cute! ",2020-05-07 05:31:41
105,eah01g,False,None,101,A Mighty Girl message,Feminism,,https://i.redd.it/wyxlayuq0k441.jpg,2058,[removed] ,2019-12-14 07:49:34
106,avg5e5,False,None,205,This illustration,Feminism,,https://i.imgur.com/1qeIYNE.jpg,2045,Feminism isn’t needed in First world countries ,2019-02-27 17:44:52
107,dh85si,False,None,53,"43 + 2 dozen = total number of women accusing him of rape, sexual assault, violence, harassment, inappropriate touching etc.",Feminism,,https://i.redd.it/1s5eurrww9s31.jpg,2040,[removed] ,2019-10-13 09:00:40
