,ID,is_Original,Flair,num_comments,Title,Subreddit,Body,URL,Upvotes,Comments,creation_date
549,hp44l0,False,None,42,"""Historically there haven't been more great women scientists because most women are hardwired to be intellectually inferior""...Well how many of these names you automatically thought belong to a male scientist?",Feminism,,https://i.redd.it/exommrv1r5a51.jpg,925,For those who want to oppress it wont change their will to oppress if the IQ was high or low. They don't care what the truth is but think oppressing low IQ would be more justified (is not) and try to convert reality to fit that narrative. ,2020-07-11 04:43:57
550,gep6fk,False,None,50,"""Stats NZ for 2019 shows 65% of female prisoners were Maori and this rose to 68% for women who were sentenced to periods of imprisonment.""",Feminism,,https://i.redd.it/ad9q44lgq6x41.jpg,926,[removed] ,2020-05-06 18:08:40
551,c7sv3k,False,None,40,Women who opposed their sexual assault have their heads shaved.,Feminism,,https://i.redd.it/ndrui13n6p731.jpg,922,[deleted] ,2019-07-01 13:55:07
552,b6aefn,False,None,10,"Denver votes to remove taxes from tampons, pads",Feminism,,https://www.9news.com/article/news/local/local-politics/denver-votes-to-remove-taxes-from-tampons-pads/73-7da3aa23-9c03-4eac-abaf-b6ca13e46484,921,Hooray!!!! ,2019-03-27 21:56:01
553,fztuga,False,None,101,"There's a medically unnecessary legal multimillion dollar female genital cosmetic-surgery(FGCS) industry. Anatomically,there's little difference between FGM & many/most of the FGCS. FGCS >> male circumcision. Yet people skip right over that fact & compare it with male circumcision. I wonder why!",Feminism,,https://i.redd.it/qxqcxyifxcs41.jpg,925,"How can you have a discussion of FGM without is devolving into some other discussion? Dont use sexist language on a gender equality subreddit. That one comment at the bottom of the post changed the subject away FGM to why would you make a declarative sexist statement? The polite professional reminder to stay within the scope of a topic is all that is usually needed in any discussion. And it was all that was needed in this one. Most topics need to be kept within scope by a moderator, so women's issues are not alone in that.  If the OP wanted to discuss FGM and not men being against it, perhaps not including the extraneous sexist sentiment would be a better strategy. Notice how the comments are all about the ""...of course men had to..."" and not really about FGM?? Oh, and just like sexism and oppression of women, FGM is upheld and promoted by women within the culture, as well as by the men! So lets say we are against FGM and anyone for it, and ignore anyone diluting the subject or justifying the practice regardless of gender identity. Intersectional 4eva. ",2020-04-12 09:37:47
554,hff71a,False,None,60,A little illustration I whipped up.,Feminism,,https://i.redd.it/1ncrxtai6z651.jpg,919,"How terribly unproductive.

The best efforts you could make to end a patriarchy is to stop day dreaming and start accomplishing! ",2020-06-25 03:25:44
555,g0jjmo,False,None,42,Sexual assault & harassment are never okay. This tweet by the NYT (now deleted) speaks volumes about their moral depravity,Feminism,,https://i.redd.it/fuahgbz08fs41.jpg,923,"They interviewed these women. Apparently those women did not characterize what Biden had done as assault, but keep pushing this narrative. Bernie has already endorsed Biden. ",2020-04-13 14:04:12
556,dqm48e,False,None,20,If the shoe fits,Feminism,,https://i.redd.it/j0fifpsa8aw31.jpg,923,"Yup, real humans are humans. ",2019-11-02 16:00:08
557,asuns8,False,None,25,Wisconsin school agrees to end its ‘big booty’ and ‘big boobie’ cheerleader awards,Feminism,,http://time.com/5533556/wisconsin-cheerleading-awards-body-parts-end/,922,The fact that existed is fucked.  ,2019-02-20 22:19:42
558,bt5q6s,False,None,41,The NFL won’t tolerate protesters,Feminism,,https://i.redd.it/vgaauya9ri031.jpg,911,[deleted] ,2019-05-26 08:49:50
559,hpl9sf,False,None,112,"Reddit just banned & quarantined some major misogynistic subreddits, including pornographic ones. But major pedophilic & transmisogynistic pornographic subreddits remain unbanned.",Feminism,"Banned:

/r/strugglefucking

/r/struggleporn 

/r/rektwhores

/r/abuseporn2

/r/degradedfemales

/r/fuckmeat

/r/abusedsluts

/r/ropedancers

/r/misogynyfetish

/r/deadeyes 

/r/sex_violence_art

/r/dolcettkingdom

/r/brokenfucktoys

/r/womenintrouble

/r/putinherplace

/r/slasherchicks

/r/cryingcunts

r/MisogynyFetishGW

r/PedophiliaDiscussion

r/MAPPositivity 

Quarantined:

/r/rapekink 

/r/rapeconfessions 

/r/rapefantasy 

/r/rapeworld 

/r/rapestories",https://www.reddit.com/r/Feminism/comments/hpl9sf/reddit_just_banned_quarantined_some_major/,911,[removed] ,2020-07-12 00:40:36
560,e4y68m,False,None,24,Misogyny in India,Feminism,,https://i.redd.it/qzx6k4gnn7241.jpg,908,"For people who say ""Women are only good for having babies"" they sure don't seem to care much. ",2019-12-02 12:06:33
561,gc4u0x,False,None,11,Sudan to outlaw female genital mutilation | The Guardian,Feminism,,https://www.theguardian.com/society/2020/may/01/sudan-to-outlaw-female-genital-mutilation-fgm?CMP=fb_gu&utm_medium=Social&utm_source=Facebook&fbclid=IwAR0PK9DGB2OpSPUG-tegMmsrQe9urOI2J079-HLrIWnOQ9uHm4O9huC7G4w#Echobox=1588346324,911,Cue comments about circumcision ,2020-05-02 11:19:56
562,e7tc3u,False,None,36,"""Lady chips are 'easy to carry in a purse.' Because ladies mustn't ever be seen buying or carrying snacks for themselves. Only for men and children. There are some things decent women keep private - like eating"".",Feminism,,https://i.redd.it/sjkzpwagoe341.jpg,911,"Didn't this idea get fucking dogpiled in America?  

As in, women eat chips because they are tasty.  So removing flavouring and crunch makes the chips less appealing.

I don't care if I don't look lady-like eating snacks.  Go FUCK yourself if I have to look dainty when consuming snacks.

Also, shades of eating disorders, man.  Women must hide their consumption of unhealthy/weight gain foods. ",2019-12-08 12:47:39
563,azyxy5,False,None,50,"Judges said rape victim's story was not credible enough because she was unattractive (too masculine "").",Feminism,,https://www.google.com/amp/s/amp.theguardian.com/world/2019/mar/11/men-acquitted-of-charges-because-victim-judged-too-masculine,911,[deleted] ,2019-03-11 21:18:47
564,7z3a01,False,None,39,"Wanted an iconic photo with this Buddha statue in Myanmar but got an ironic one instead, during my fieldwork on Gender and Nationalism in Myanmar.",Feminism,,https://i.redd.it/6v1xxcxd8ih01.jpg,907,I think it's far more ironic for people educated in world history and science to enter ANY religious establishment. ,2018-02-21 05:47:15
565,d7qo58,False,[Trigger Warning],69,Not a rapist.,Feminism,,https://i.redd.it/1o13zzz3r1o31.jpg,900,"""What were you like at 17?""


Way too into anime.


Oh, and dealing with PTSD and the beginnings of an eating disorder as a result being molested as a small child and having my family cover it up to protect my abuser and make me deal with it alone.


*You know, normal girl stuff.* ",2019-09-22 13:50:48
566,baf5v6,False,None,6,Testimonies of Rwandan women helped establish WAR RAPE as WAR CRIME.,Feminism,,https://www.aljazeera.com/indepth/opinion/courage-rwandan-women-changed-world-190405152024420.html,900,Let them in ,2019-04-07 11:01:11
567,cleyrj,False,None,35,Big Oof,Feminism,,https://i.redd.it/y2hp3ap626e31.jpg,898,The sad thing is if they wanted to bring Rome up they could argue that Islam killed Rome and they would technically be correct. ,2019-08-03 05:05:12
568,8jmuvb,False,None,94,Benedict Cumberbatch Won't Take a Role if Female Co-Star Isn't Paid Equally,Feminism,,https://www.globalcitizen.org/en/content/benedict-cumberbatch-gender-wage-gap/?utm_source=facebook&utm_medium=social&utm_content=global&utm_campaign=general-content&linkId=51693123,898,[removed] ,2018-05-15 16:18:58
569,9ngy5r,False,None,81,Brazilian feminists are terrified during this election. Please keep us in your thoughts.,Feminism,"If you don't know what's going on, search for the tag #EleNao, or maybe just watch the John Oliver video about Bolsonaro.

We are desperate. We are terrified. Not only us, but every minority. We are risking another military dictatorship. I cannot stop crying since the first round of votes.

Please don't forget us. Please, spread the word about us.",https://www.reddit.com/r/Feminism/comments/9ngy5r/brazilian_feminists_are_terrified_during_this/,903,"John Oliver is part of the liberal propaganda and is likely to misrepresent conservative views.

But I am curious, what is your concern?

Edit - hey I can't respond because ban thanks ",2018-10-12 03:46:58
570,e2wnyv,False,None,39,"""Rough Sex gone Wrong"" defense: 45% of the time, this claim in a homicide defence results in a lesser charge of manslaughter, a lighter sentence,/the death not being treated as a crime at all. & in the last 5 years, it's worse, with 50% success in ""sex game"" claims.",Feminism,,https://i.redd.it/s7cj22ldue141.jpg,897,[removed] ,2019-11-28 11:12:41
571,bqjl6m,False,None,154,Don't tell far-right wing pro-forced birth men what to do with their bodies !!!!!!!!!!!,Feminism,,https://i.redd.it/aano3u2fe7z21.jpg,897,[removed] ,2019-05-19 17:33:34
572,1lyj84,False,None,77,This deserves to be seen again and again until people get the fucking message,Feminism,,http://i.imgur.com/FWFlYTW.jpg,893,"All I want to say is that this is brilliant, and that I hope the creator sees this. ",2013-09-08 06:17:23
573,7zci3b,False,None,35,Regulating while ignorant,Feminism,,https://i.imgur.com/fRVwDEO.jpg,890,"To be fair, an AR-15 being a non assult weapon, is like saying the Female reproducitve system gives live birth. Both are very general statments, thy arent saying to understand every aspect of the gun ",2018-02-22 05:32:11
574,1t7b8d,False,None,177,as a dude who works at a rape crisis center i have come to learn this....,Feminism,,http://3.bp.blogspot.com/-7RmPlqFrWV4/UIxBrNUjo3I/AAAAAAAAA1o/Jm83gfDdybw/s1600/Patriarchy+hurts+men+too+quote.jpg,893,Image of text...*Can't tell if this is only a ploy for Reddit Karma* ,2013-12-18 22:50:39
575,cgdq5k,False,None,69,Intersexism,Feminism,,https://i.redd.it/s1ez8j075vb31.jpg,886,"If you have a problem, come with a solution. We need to know how to support you. ",2019-07-22 14:14:13
576,9vm3h2,False,None,77,"“So much of women’s workwear is designed to look good, but not actually support women as they do their jobs...Women’s pockets shouldn’t be a novelty item”",Feminism,,https://www.fastcompany.com/90262598/pockets?fbclid=IwAR2jkw8bxnF5WkjPiNlPb0q00H8wZ2cNZVYQrReGHDWE4r5Fpmn0XQcHv60,892,The Market sells what people buy; people buy what the Market sells. No one has forced this on us; we can change it together with our pocketbooks. ,2018-11-09 16:55:01
577,8zc9ax,False,[Rape culture],29,"#MeToo was a powerful movement, however, no one should have to publicly share details of a traumatic assault in order for people to accept that there’s a problem.",Feminism,,https://www.verveup.com/shesaid/me-too,887,"I think journalists and media should be criticized for this issue, not the brave women who stood up for us.  ",2018-07-16 16:19:56
578,aet8oi,False,None,73,Archie on Double Standards (xpost from /r/comicbooks),Feminism,,https://i.redd.it/n7m7hj638n921.jpg,887,[removed] ,2019-01-11 08:07:01
579,dzo4w0,False,None,81,"""6/BDSM is now a strategic defense for men in the way that 'provocation' has previously been. And to see it increasingly being used, and working, over the last few years is hugely troubling. 7/There is nothing a woman can do to cause a man to kill her""",Feminism,,https://i.redd.it/4aujgs4t83041.jpg,891,[removed] ,2019-11-21 19:07:59
580,9lizyj,False,None,50,Dear Senators!,Feminism,,https://i.redd.it/4gvh8kyejaq11.png,882,"Ugh, I love this. It makes me sick that it didn’t work. ",2018-10-05 04:01:02
581,a9i724,False,None,75,"It’s almost like men who think they’re superior to everyone else, aren’t gonna view you as an equal (xpost /r/fuckthealtright)",Feminism,,https://i.redd.it/9svn0obrge621.png,882,"*Yawn* 

 ",2018-12-25 20:51:06
582,fzu80e,False,None,18,Handling the truth,Feminism,,https://i.redd.it/w4pekuv73ds41.png,878,[removed] ,2020-04-12 10:10:34
583,enbhq7,False,None,39,Don't be confused.,Feminism,,https://i.redd.it/7wfepgm8m5a41.jpg,874,[removed] ,2020-01-11 18:57:09
584,eq9tat,False,None,157,A reminder that TERFs aren't feminists and they don't stand for what we stand for,Feminism,,https://rvamag.com/gay-rva/jk-rowling-is-on-board-the-terf-train.html,882,[removed] ,2020-01-18 01:24:44
585,cxddbp,False,None,45,Abortion Right in India,Feminism,,https://i.redd.it/dm7gb9dcbjj31.jpg,872,[removed] ,2019-08-30 07:00:24
586,cppd55,False,[Trigger Warning],67,"they don't protect us, they rape us. Police officers raped a 17-years old girl",Feminism,"This is the first time I post on this subreddit. Last week a 17-year-old girl was raped by 4 police officers inside the patrol car, she made her complaint but someone leaked the basic data of her complaint as her name (this is illegal) so the women of Mexico City decided to protest , your integrity was violated by filtering your personal data. The protest went out of control and some women in despair of being heard decided to exert violence by breaking doors and writing on walls ""rapists"" and the hashtag of the protest that is ""#NoMeCuidanMeViolan"" which means ""they don't protect me, they rape me"". Many are judging the fact that women used violence and damage to other people's property, but it is a desperate act for a situation that warrants it, in recent years Mexico has been increasing in femicide and rape. However, the authorities still do nothing. I share that because this situation is not being sufficiently viralized, we need the eyes of the world to focus on the crisis that women in Mexico experience because of the little importance that our authorities give it.",https://www.reddit.com/r/Feminism/comments/cppd55/they_dont_protect_us_they_rape_us_police_officers/,870,[removed] ,2019-08-13 06:49:02
587,g4ufjn,False,None,69,"During the Plague in Europe, men took the opportunity to take away women's legal rights and status. We should beware the same happens to us. They're trying!",Feminism,,http://en.arabellahutter.com/73rd-thread-like-frogs-in-a-pond/,869,In case ur wondering it probably won’t happen. And if u want proof I can go all day! ,2020-04-20 15:05:24
588,23x706,False,None,96,Cajones,Feminism,,http://imgur.com/N0FNaLB,874,[removed] ,2014-04-25 03:16:06
589,dejupj,False,None,44,Female cop ‘left in forest by male officers as revenge for reporting sex crime',Feminism,,https://metro.co.uk/2019/10/04/female-cop-left-forest-male-officers-revenge-reporting-sex-crime-10863932/?ito=article.desktop.share.bottom.facebook&fbclid=IwAR1JWezQJVqHHvxgmUgk9jCO7TOjqGlZASY7j_RoX1N8Peopt9VzcoPHCOA,869,Meanwhile in the middle east: a woman loses her job and is labeled as a traitor because she infiltrated an ISIS stronghold singlehandedly to save female sex slaves and take down anyone who stood in her way but let's focus on the fake bullshit feminism in the west but hey who needs feminism in the fuckinh middle east am I right 🤷‍♂️ ,2019-10-07 14:02:35
590,27n838,False,[Comic],78,"In short terms, I'm a feminist",Feminism,,http://imgur.com/Sn1M9a8,872,[removed] ,2014-06-08 21:09:46
591,cvl4ze,False,None,36,Medical Milestone - Matt Czap,Feminism,,https://i.imgur.com/F71iHAD.png,866,I do not see the point of a diagnosis if the doctor is just going to nod his head like a moron while mumbling that he believes her. How about doing actual research beyond looking for tits when deciding whether your client is right about their illness or not? ,2019-08-26 08:14:59
592,6035cy,False,[Violence],47,Girl who was penalised for 'wasting police time' for making complaints against her ex-boyfriend later had her throat slit by him,Feminism,,http://www.bbc.co.uk/news/uk-england-sussex-39306323,869,[removed] ,2017-03-18 08:24:02
593,a9p0zj,False,None,145,My 9yo sister got this for Christmas. It came with a juice box to further the imagery of this being a baby. She got a huge box filled with these. Wtf. How can people deny the sexualization of little girls anymore?? This is disgusting.,Feminism,,https://i.redd.it/aahgzl7nvm621.jpg,866,[removed] ,2018-12-26 14:36:58
594,cnyxku,False,None,81,Nooooooooooooooooooo shit,Feminism,,https://www.vice.com/en_ca/article/7xgaje/men-who-send-unsolicited-dick-pics-are-bigger-narcissists-study-finds,860,Just men being men... well... ,2019-08-09 07:21:59
595,aq94sr,False,None,43,Night Witches - The Female Fighter Pilots from WW2,Feminism,,https://i.redd.it/w0u7fdo8jbg21.jpg,866,"I’ve heard of women in ww2 being Russian snipers but never this before, the story seems a bit exaggerated but cool nonetheless.  ",2019-02-13 17:37:44
596,9lcv7v,False,None,52,Stop comparing women to inanimate objects.,Feminism,,https://i.redd.it/vklildqdutp11.jpg,861,"I just wanna point out the ironic part about this.the source is ""WeHateFeminism"" ",2018-10-04 15:24:53
597,ga7le1,False,None,25,COVID-19 and Christian Misogyny,Feminism,,https://i.redd.it/1wx39owpqqv41.jpg,864,"When a simple “we’re all going through trying times, be kind and understanding to one another, this includes everyone” is too, you know, radical. ",2020-04-29 11:17:31
598,dqzlvx,False,None,14,"Trump's Anti-Abortion Policies Have Created A Nightmare For Women In Nepal. Every time a Republican is in the White House, women across the world face the devastating impact of the US's ban on discussing abortion in exchange for aid.",Feminism,,https://www.google.com/amp/s/www.buzzfeednews.com/amphtml/nishitajha/trump-global-gag-rule-nepal,866,[removed] ,2019-11-03 12:14:00
599,dwvura,False,None,31,I've just attended a conference at the University of Fribourg. Chimamanda Ngozi Adichie was invited to speak. She is a remarkable woman.,Feminism,,https://i.redd.it/azegfy7dmwy31.jpg,860,eh ,2019-11-15 19:47:21
600,b01x11,False,None,61,Creepy Garfield comic strip presented an opportunity to talk to my young son about affirmative consent; even he knew this was wrong.,Feminism,,https://i.redd.it/fzaymjf8fll21.jpg,860,[deleted] ,2019-03-12 01:45:11
601,fsk7b0,False,None,30,"Neruda was a RAPIST: After the woman ignored his advances, Neruda says he took “a strong grip on her wrist” & led her to his bedroom. “The encounter was like that of a man and a statue. She kept her eyes wide open all the while, completely unresponsive,” he recalled. “She was right to despise me.”",Feminism,,https://i.redd.it/yatb9i2ue2q41.jpg,858,"I have had to study him in my poetry class. His poetry, especially about Josie Bliss, reeks of racism. He's so full of himself. ",2020-03-31 20:07:27
602,eyrvau,False,None,12,Women in Science,Feminism,,https://i.redd.it/ybfy48ligxe41.jpg,857,"It really can't be overstated how totally revolutionary Lane-Claypon's 1926 report was.

The actual nature of her work (breast cancer research) was obviously important on its own, but the methods she employed completely changed our concept of scientific studies. 

She literally created the idea of comparing case studies (in this case, those with breast cancer) against control groups (those without). She also pioneered the use of statistical analysis to determine the likelihood that the difference between the groups was due to random chance. 

Lane-Claypon's name should be known to every student of biological science. She should be right up there with Darwin, Mendel, Hooke, and Pasteur. ",2020-02-04 15:42:30
603,dfozy7,False,None,53,Rape,Feminism,,https://i.redd.it/9kuci4v3jlr31.jpg,853,"Rape is considered a war crime. But like all other war crimes, it's only a war crime in certain context. Just like killing someone is not a war crime (or terrorism for that matter) but killing someone blowing up a bomb in the middle of the town square is.

That said, it's sadly a very recent addition to the list of war crimes. ",2019-10-09 23:00:32
604,bnf2v7,False,None,6,Mary Wallace: First female bus driver for Chicago Transit Authority (1974),Feminism,,https://i.redd.it/4q9nljqaykx21.jpg,850,And she is also black ,2019-05-11 18:10:38
605,cd2jm9,False,[Trigger Warning],77,Man Perfectly Explains Women’s Rage Today Using Brutal Analogy So That All Men Can Finally Understand It,Feminism,,https://www.boredpanda.com/nut-kicking-analogy-brett-kavanaugh-case/?media_id=1048547179193946112-png__700&utm_source=facebook&utm_medium=social&utm_campaign=organic,850,[deleted] ,2019-07-14 12:37:24
606,92h7tr,False,[Abortion rights],28,A new art exhibit in Denver tells the stories of women who died due to botched abortions prior to Roe v Wade,Feminism,,https://theknow.denverpost.com/2018/07/20/daisy-patton-portraits-abortion-denver/190222/,853,"Just after I turned 15, I was being molested by a man that was 26. He impregnated me. I wasnt old enough to get a job. I’d just started 10th grade. My mother didn’t want me to get an abortion. So, I found a loophole and traveled to Washington DC to get one. It was the best decision I’ve ever made. If I was forced to give birth to my molesters child at 15, I probably wouldn’t have finished high school or college. I’d probably be living off of government assistance. It’s very likely that I wouldn’t have been able to provide a good life for my baby and it’s very likely that we wouldn’t have had the best relationship. ",2018-07-27 22:52:11
607,hgajm4,False,None,16,New Zealand supermarket chain becomes first to use 'period' label on menstrual products | New Zealand,Feminism,,https://www.theguardian.com/world/2020/jun/26/new-zealand-supermarket-chain-countdown-becomes-first-to-use-period-label-on-menstrual-products,852,[removed] ,2020-06-26 16:15:07
608,frjlwk,False,None,17,"Women scientists have a 19.5% higher risk of leaving academia *every year*, which gives male authors a major cumulative advantage over time.The dropout gap persists at similar rates throughout scientific careers. To reduce the gap, the emphasis should be on providing sustainable career for women.",Feminism,,https://i.redd.it/enhi4qx6eqp41.jpg,843,[removed] ,2020-03-30 03:42:30
609,eh0ekt,False,None,17,She is recognized as the first woman to have completed a voyage of circumnavigation of the globe.,Feminism,,https://i.redd.it/vkvzr10vkh741.jpg,845,"Misogyny makes trans history so muddled. In an ideal world, we could claim Baret as a trans masc icon, but obviously it's a lot more complicated than that. Still, I find it fascinating to speculate where the line is between cross dressing, gender nonconformity and being trans. Lots and lots of people like this throughout history, Hua Mulan, Joan of Arc, Mary Read and a lot of others. ",2019-12-29 02:49:24
610,94whbv,False,None,73,"Woman was told to ""cover up"" whilst breastfeeding.. so she did!",Feminism,,https://i.redd.it/x6bbaf3wlbe11.jpg,845,[removed] ,2018-08-06 00:04:39
611,bmo19i,False,None,14,Two Production Companies Say They Won't Film in Georgia Over Abortion Law,Feminism,,https://www.hollywoodreporter.com/news/two-production-companies-say-they-wont-film-georgia-abortion-bill-passes-1209168,841,"Utterly disgusting law and I hope Georgia gets everything they've got coming to them. Boycott, divest, sanctions. ",2019-05-09 19:26:10
612,9is9yd,False,None,70,Man who slapped woman's bottom gets first fine under new French 'cat-call' law,Feminism,,http://news.trust.org/item/20180925124532-jsj3y/,836,It's about damn time. ,2018-09-25 13:49:06
613,fc9n2l,False,None,28,"During the 1971 Bangladesh war for independence, members of the Pakistani military & Razakar rapedbetween 200,000 & 400,000 Bangladeshi women & girls in a systematic campaign of genocidal rape to terrorise both the Bengali-speaking Muslim majority & the Hindu minority of Bangladesh.",Feminism,,https://i.redd.it/wc21n73na8k41.jpg,837,"For those interested, The Blood Telegram is a fascinating book on this. Basically, the Awami League won a democratic election in what was then East Pakistan (now Bangladesh), and West Pakistan (now Pakistan) didn't like that - it would mean too much autonomy for East Pakistan, they thought. West Pakistan wanted all political power to say concentrated. So the Pakistani military, in large part led by Yahya Khan, started raping and slaughtering Bangladeshis. Hindus were specifically targeted, and Muslims were targeted essentially because they associated with Hindus. India took in hundreds of thousands of Hindu (and Muslim) refugees from Bangladesh, as they were driven from their own country.  The Hindu population in Pakistan continues to dwindle, and reports of religious discrimination against non-Muslims is very common. Pakistan has insanely archaic blasphemy laws (punishable by death), which are supported by their P.M., Imran Khan.  Asia Bibi, a Christian Pakistani woman who allegedly insulted Mohammed is the most recent/famous case. She was on death row for years, but due to international attention and criticism, was able to seek asylum abroad. ",2020-03-02 09:29:49
614,ev2vco,False,None,271,Kobe Bryant confessed to rape. That's part of his story.,Feminism,,https://blog.penelopetrunk.com/2020/01/28/kobe-bryant-confessed-to-rape-thats-part-of-his-story/?inf_contact_key=d981e004133844515a40bb2f1dd2774f16358d5485884e2f31e6019a0d26c8b0#comments,839,[removed] ,2020-01-28 08:29:41
