,ID,is_Original,Flair,num_comments,Title,Subreddit,Body,URL,Upvotes,Comments,creation_date
771,bdgdpu,False,[Domestic Abuse/Violence],55,Police fined her when she kept reporting her ex-boyfriend for stalking. Then he killed her.,Feminism,"Content Warning: Intimate Partner Violence 

&#x200B;

[https://www.washingtonpost.com/world/2019/04/10/police-fined-her-when-she-kept-reporting-her-ex-boyfriend-stalking-then-he-killed-her/?fbclid=IwAR3pq\_4t6EafPgX\_qxEDaE9HoMRIeo-E0aJjzwfATXo3Q0\_wxenBnHoATt8&noredirect=on&utm\_term=.e27c77a9e01a](https://www.washingtonpost.com/world/2019/04/10/police-fined-her-when-she-kept-reporting-her-ex-boyfriend-stalking-then-he-killed-her/?fbclid=IwAR3pq_4t6EafPgX_qxEDaE9HoMRIeo-E0aJjzwfATXo3Q0_wxenBnHoATt8&noredirect=on&utm_term=.e27c77a9e01a)",https://www.reddit.com/r/Feminism/comments/bdgdpu/police_fined_her_when_she_kept_reporting_her/,699,Why does reddit show me trending posts on subreddits im not subscribed to. I don’t care about this shit. I just wanna browse memes and stay up to date on games. I don’t wanna see this. ,2019-04-15 14:07:18
772,gaz5hl,False,None,88,This sub makes me happy,Feminism,"It's great to find a feminist sub that supports trans people and actively bans TERFs.
I'm sick of people making it impossible for me to be an active feminist because I'm not cis. It's like every feminist group and organisation I find that I'd be interested joining either actively or passively discriminates against trans people.

Anyway, hi! It's lovely to meet you all.",https://www.reddit.com/r/Feminism/comments/gaz5hl/this_sub_makes_me_happy/,692,[removed] ,2020-04-30 16:39:06
773,52b1sr,False,None,56,If i'd go to space I think I'd braid my hair....... 😓,Feminism,,https://i.reddituploads.com/d688eae90fd04658bf832bd821dca918?fit=max&h=1536&w=1536&s=42fd955e2efe5342f8b896e123cac9e3,694,"When Chris Hadfield went to space, he enlightened the world in every single way he could. Inspired the curiosity and wonder like this generation has never seen from an astronaut. He showed what happens when you cry in space, what it was like to brush teeth, eat breakfast. He tried to answer any question possible to feed the minds of the world. He made every effort to be approachable.

But yeah, let's celebrate this chick for her over the top response to a question many here agree they are interested in knowing the answer too. ",2016-09-11 22:19:47
774,8ghq78,False,None,194,"Boy Scouts add girls, drop the word 'boy,' will be called Scouts BSA",Feminism,,https://www.usatoday.com/story/news/nation-now/2018/05/02/boy-scouts-scouts-bsa-girls-joining-cub-scouts/572036002/,698,[removed] ,2018-05-02 14:16:11
775,2raev5,False,[Activism],106,"A man on why he needs feminism, not ""men's rights"".",Feminism,,http://media.tumblr.com/54f6f2548511122d9e99487298b76a28/tumblr_ndavmtkvhA1sk4sslo1_1280.jpg,693,"You all need to stop whining about how you had to make a sandwich and are now "" oppressed ",2015-01-04 09:17:40
776,bm10ag,False,[Cultural issues],29,"Jill Biden says it's time to 'move on' from her husband's treatment of Anita Hill.How About We Don’t Sweep Destroying a Woman’s Credibility and Character in front of the National Press, Public, and Congress Under The Rug. Kavanaugh was a National Embarrassment let’s not Repeat That.",Feminism,,https://www.businessinsider.in/jill-biden-says-its-time-to-move-on-from-her-husbands-treatment-of-anita-hill-during-the-1991-clarence-thomas-confirmation-hearings/articleshow/69225164.cms,690,https://joebiden.info/ ,2019-05-08 04:42:20
777,6am341,False,[Cultural issues],98,Seen outside a jeweler. This is why we need feminism.,Feminism,,https://i.redd.it/q5bpsqva1xwy.jpg,687,"Yep, this is it.  ",2017-05-11 18:40:46
778,hkgf56,False,None,26,"German government makes upskirting and neckline photographs illegal, punishable by fines or prison sentences",Feminism,,https://www.thelocal.de/20200703/germany-makes-upskirting-illegal-and-promises-harsh-penalties,687,[deleted] ,2020-07-03 10:03:10
779,bohy74,False,None,33,"Surprising no one, Trump campaign paid women employees nearly 20% less than male counterparts",Feminism,,https://www.cnbc.com/2019/05/13/trump-campaign-paid-women-like-omarosa-less-than-men-filing-says.html,696,It's easy to find quality female employees. Just grab em by the pussy./s ,2019-05-14 11:55:10
780,hha9od,False,None,87,"""Antifeminism is a direct expression of misogyny; it is the political defense of woman hating."" ""The woman hating implicit in the antifeminism is designed to humiliate the woman so that she feels the humiliation and so that those listening can see her being humiliated and feeling it.""",Feminism,,https://i.redd.it/za1sto0drl751.jpg,686,"You can’t even argue with people like this, might as well bang your head on a brick wall ",2020-06-28 07:21:47
781,c0iish,False,None,3,"Mary Adela Blagg, one of the 1st five women accepted as fellows of the Royal Astronomical Society, standardized lunar nomenclature, publishing the 1st definitive work naming lunar features. Blagg crater is named after her. She also observed variable stars & cared for the orphan children during WWII.",Feminism,,https://i.redd.it/294e9sghua431.jpg,686,,2019-06-14 10:29:37
782,1acnuf,False,None,193,"While most mannequins are size 4-6, these Swedish mannequins are promoting a healthier and more realistic body image.",Feminism,,http://i.imgur.com/uEQYb9L.jpg,689,[removed] ,2013-03-15 14:37:42
783,bndcyq,False,None,46,The rise of the far-right is costing women their dignity & human rights around the world as (hetero) male supremacy is at the very core of far-right ideology.,Feminism,,https://www.independent.co.uk/voices/women-feminism-far-right-trump-bolsonaro-orban-abortion-a8908851.html,690,[removed] ,2019-05-11 15:36:58
784,6y0yeq,False,None,105,Found this on imgur and I love it,Feminism,,https://i.redd.it/ftvmxbrgwvjz.jpg,685,[removed] ,2017-09-04 15:24:48
785,gfitdw,False,None,121,Lesbian feminists,Feminism,"Little rant here. I hate how some people insult feminists by calling us lesbians. In this show im watching called Mrs America they insult feminists by calling them ""commie lesbians"" but it obviously happens more then that. Firstly, lesbian is not an insult, it just means youre a woman who likes women. Secondly, not all feminists are lesbians. Thirdly, being a lesbian doesnt mean you hate men it just means youre not attracted to them. Also, as a lesbian feminist myself it really hurts me because I feel insulted and stereotypical",https://www.reddit.com/r/Feminism/comments/gfitdw/lesbian_feminists/,686,[removed] ,2020-05-08 00:31:19
786,ft2flr,False,None,33,"Don't Nag Your Husband During Lockdown, Malaysia's Government Advises Women",Feminism,,https://www.npr.org/2020/04/01/825051317/dont-nag-your-husband-during-lock-down-malaysias-government-advises-women,687,[removed] ,2020-04-01 15:58:20
787,hl7tzx,False,None,9,"It’s time we realize that the US is rife with injustice and posting a black box on your Instagram is not enough. To celebrate the 4th of July, I wrote a guide with a hundred different ways to sustainably and continually support Black American lives (and also specifically support black women)",Feminism,,https://releasethewomen.com/2020/07/04/more-than-a-black-square-a-blm-guide/,685,"I’m still updating - I just added new resources like the Buy from Black Women directory and and black version of amazon - so please share if you found this helpful! And if you know of any other BLM resources, feel free to let me know and I’ll add it! ",2020-07-04 18:11:50
788,fff8s9,False,None,16,8M March for International women's day in Chile,Feminism,,https://i.imgur.com/zer9bqE.jpg,686,Though idk if throwing stones at female police officers is the best way to protest imo. ,2020-03-08 16:53:46
789,f6az4x,False,None,92,Pakistan Court Rules That Men Can Marry Underage Girls After They've Had Their First Period,Feminism,,https://www.globalcitizen.org/en/content/pakistan-court-allows-men-to-marry-underage-girls/,679,Usually I would say ok and not worry but that one is absolutely disgusting. ,2020-02-19 13:59:47
790,acwk3o,False,None,50,This goes viral after we’ve learned that 1) Drake went after an 18-year-old model that he’d been flirting with since she was 16 and 2) Drake regularly texts a 14-year-old actress and talks to her about boys. Three’s a pattern. Protect young women.,Feminism,,https://www.reddit.com/r/hiphopheads/comments/acrz8c/video_has_surfaced_of_drake_kissing_and_touching/,684,[removed] ,2019-01-05 18:13:41
791,d921th,False,None,47,Surrogacy,Feminism,,https://i.redd.it/xys0up0w8qo31.jpg,679,"I think it’s a type of labor, like all labor it can be exploited. It also is something that only effects women which makes it even worse. I don’t know if outlawing commercial surrogacy outright would help or hurt these women. But more CLEARLY needs to be done to regulated it especially internationally.

Also fucking adopt. Those kids need you. ",2019-09-25 11:39:47
792,b8jke5,False,[Disputed content],197,This cartoon was posted as an attempt to accept religious freedoms. But all it made me think was: does she really have a choice. Muslim women in the west do but who will stand with those living under Shari law without a voice at all? Are we normalizing oppression under the guise of tolerance?,Feminism,,https://i.redd.it/2be3n7d7xup21.jpg,681,[removed] ,2019-04-02 13:58:28
793,g6pa7k,False,None,165,Why are men so mad at OnlyFans?,Feminism,"This is a rant- kind of??; This is something that’s been bothering me since the beginning of 2020 and feel like I need to address it.

If people wanted to argue that more young women turning to sex work for money Is a growing issue, I would be on board. A woman shouldn’t feel like selling her body is her only option. That would be oddly enough, an actual way to help women in need and protect teenage girls. Of course that’s not the case. None of these men want to help these women, none of these men would even consider donating to a women’s charity because they don’t think the oppression of women exist anymore. Societal views on women are enough to argue that we are not “equal” and aren’t treated with the same respect as men. Just because women can legally “do whatever they want” doesn’t mean women don’t face a significant amount of societal pressure for so many things it’s ridiculous. A woman can’t even own her own body without men putting their 2cents regarding it. 

For clarity, I’m speaking about the men that shame women for sex work. Apparently, a woman benefitting from her own body is so obscene that these men feel the need to retaliate and get angry at women they don’t even fucking know. News flash, just because you are attracted to a woman doesn’t mean her actions are of ANY importance to you. YOU.DO.NOT.OWN.HER. I’m sorry that a chick you would fuck in the right circumstances isn’t all what you hoped to be, go look at the other women you thirst for on a daily basis. You are not loyal to her, so why would she have loyalty towards you or any of the other men that follow her only because she’s hot?

Women are grown ass adults that can hold themselves accountable and know exactly what they’re doing. We don’t need men’s approval and I don’t know why these men react to Onlyfans as if we do. 



Unrelated comment (not necessary to read):
Judging by social media, a lot of men have an issue with the use of the word ‘men’. They’re so quick to take the blame off of other men by pouting “not all men!” It’s as if they are purposely taking feminist/women out of context. Of course we aren’t talking about EVERY SINGLE man in existence. If certain men are willing to be offended by the general use of the word “men”, they should be willing to accept and admit the privileges they have as a man. If I say, “men created beauty standards for women” do not respond with “not all men!” It doesn’t make what I said any less of a problem and doesn’t generate hope for men because I’m not talking about the men who don’t perpetuate the problem. I don’t need to “hope” that there’s good men, my hope is reserved for the men who can’t comprehend something so simple as respecting women and their decisions.",https://www.reddit.com/r/Feminism/comments/g6pa7k/why_are_men_so_mad_at_onlyfans/,676,[removed] ,2020-04-23 16:01:04
794,609heg,False,None,40,UK rape victims to get pre-trial recorded interview option instead of having to be cross-examined in front of the accused.,Feminism,,http://www.bbc.co.uk/news/uk-39319495,682,[removed] ,2017-03-19 10:36:26
795,g9am33,False,None,102,"Jessica Valenti: ""Believing women means doing so whether it's politically convenient or not."" And what about other 7 survivors? They are also entitled to feminist solidarity.",Feminism,,https://i.redd.it/it4b33x0pfv41.jpg,679,"Didn't women and people of color overwhelmingly nominate Biden? Looking at the publicly available primary stats, it sure looks like they did. No one stole the nomination from anyone. The will of the democratic people was heard and the verdict is, they want an assailant before a progressive. It's gross but that's the world we live in, not the world this meme was imagined in. ",2020-04-27 22:08:24
796,f8ba9k,False,None,18,Weinstein Trial Begs a Question: Why Is the Pain of Women and Minorities Often Ignored?,Feminism,,https://www.commondreams.org/views/2020/02/20/weinstein-trial-begs-question-why-pain-women-and-minorities-often-ignored,674,"I think we need a study on this one that culminates in a big ""duh"" after 10 years. 

If it doesn't happen to you or someone you know, it's not important. ",2020-02-23 16:00:00
797,deylf7,False,None,16,The Women Who Changed The Tech World #AdaLovelaceDay #ALD2019,Feminism,,https://i.redd.it/pxbqt22xhar31.png,677,What about that girl who helped photograph THE FIRST BLACK HOLE? ,2019-10-08 11:23:56
798,b4t5uv,False,None,50,"OMG, this is perfect",Feminism,,https://i.pinimg.com/564x/d0/ed/33/d0ed3304e3d59e36ed67b0b0ad063135.jpg,681,"I think you all missed the point. The moment you share a secret and decide who is allowed to know, you control it. I know it sounds weird and I do not say that this is the way it should be, but I just think that the boys were way more confident and less awed.

Still, keeping a secret is definitely a good trait! ",2019-03-24 06:04:56
799,axjynb,False,None,181,Percentage of Europeans who think rape is ok in certain circumstances.,Feminism,,https://i.redd.it/qho1sgox8ak21.jpg,677,"First of all, the 38% - 100% is a bit of a shitty thing to do, just makes everything look even worse than it already is 

Secondly, gunna call bullshit on this unless there’s some somewhat reliable source  ",2019-03-05 11:06:09
800,b2z05x,False,None,8,Karen Uhlenbeck is 1st woman to win the Abel prize for mathematics.,Feminism,,https://www.quantamagazine.org/karen-uhlenbeck-uniter-of-geometry-and-analysis-wins-abel-prize-20190319/,676,That's fantastic. Congratulations to her. ,2019-03-19 15:47:11
801,8yvu2w,False,None,90,Feminist poster in Melbourne,Feminism,,https://i.redditmedia.com/AKy5HD9R2IZ-FVVbCK9S9HkvYceH12vbMpqUcQdAff4.jpg?w=1024&s=acf24247a249602f23860425069a5d88,674,[removed] ,2018-07-14 19:38:14
802,egmw28,False,None,10,"""What Were You Wearing?"" A Campus Art Exhibit Addresses Misconceptions About Sexual Assault",Feminism,"[https://www.texasmonthly.com/the-culture/art-exhibit-what-were-you-wearing-texas-am/](https://www.texasmonthly.com/the-culture/art-exhibit-what-were-you-wearing-texas-am/)

This roving art exhibit has students addressing the issue of sexual assault using the clothing of sexual assault survivors (lent to the exhibit by the survivors themselves) and the new perspective it brings to the subject.",https://www.reddit.com/r/Feminism/comments/egmw28/what_were_you_wearing_a_campus_art_exhibit/,673,Wish there were an installation like this near me. I'd love to see it ,2019-12-28 05:40:35
803,7es8jb,False,None,18,Roy Moore On Pedophilia Accusers: ‘These Women Are Only Discrediting Me Now Because Shifting Sociocultural Norms Have Created An Environment In Which Assault Allegations Are Taken Seriously’ | The Onion says it best as usual,Feminism,,https://politics.theonion.com/roy-moore-on-pedophilia-accusers-these-women-are-only-1820405898,671,"Alabama Senate Special Election 2017 

[Voter Registration Deadline](https://www.alabamainteractive.org/sos/voter_registration/voterRegistrationWelcome.action): November 27, 2017 

[Non-Military Absentee Postmark Date](https://www.alabamainteractive.org/sos/voter_registration/voterRegistrationWelcome.action): December 11, 2017 

[General Election](https://myinfo.alabamavotes.gov/VoterView/PollingPlaceSearch.do): December 12, 2017 

 ",2017-11-22 16:37:24
804,f7sezn,False,None,17,"This Engineer Experienced Sexual Harrassment at Uber, And Reported It. The Aftermath Was More Terrifying Than She Thought.",Feminism,,https://time.com/5784464/susan-fowler-book-uber-sexual-harassment/,671,How awful. The entire thing is infuriating but the part that angers me the most is the fact that one of the people stalking her was a woman. There’s something particularly heinous about the fact that she was working to bring poor Susan down because Susan spoke out against misogyny in the workplace - it almost feels like a betrayal of our gender as a whole. I don’t understand how women can agree to work for or defend men who hate women. ,2020-02-22 13:17:47
805,ekzgmy,False,None,29,Freedom is never voluntarily given by the oppressor; it must be *demanded* by the oppressed.,Feminism,,https://i.redd.it/s00y9cjco6941.png,664,"It shouldn't be watered down, but we also don't want to represent the movement in a negative light. Had MLK led violent protests nothing would have changed. By persevering and standing up for justice and equality peacefully in the face of violent oppression he held the moral high ground and with other civil rights leaders fundamentally changed our entire country. 

Feminism has also made a profound difference and we are on our way to having a more fair and equal society. More and more women are getting into stem and politics and ultimately whether the establishment likes it or not that's not going to change. I hope that within the next decade we will have a woman in the Whitehouse and there is a huge possibility of that happening. ",2020-01-06 20:06:48
806,2f627m,False,None,23,"""welcome to reddit"" - xpost from /r/Shitty_Watercolour",Feminism,,http://i.imgur.com/eVagkul.jpg,670,But how is this different from all of the shitty magazines who stalk celebrities and gossip? ,2014-09-01 13:35:04
807,fpd91g,False,None,57,Is #MeToo Finally Catching up With Joe Biden?,Feminism,,https://medium.com/@matthewjohn_36675/is-metoo-finally-catching-up-with-joe-biden-1354b640870?source=friends_link&sk=3d48c9594068b9aa76986c30a1ed3245,668,It's shocking that suburban females flocked to this guy's campaign. ,2020-03-26 15:18:05
808,dihbr9,False,None,34,Ripple effect of transmisogyny,Feminism,,https://i.redd.it/tlo09juptss31.jpg,666,[removed] ,2019-10-16 00:36:43
809,d6gyqx,False,None,26,Programmer creates dick pic filter after getting sick of receiving them,Feminism,,https://www.theguardian.com/lifeandstyle/2019/sep/19/its-a-violation-the-war-on-unwanted-dick-pics-has-begun,671,"Dick Pics. Frankly, the act of a moron. ",2019-09-19 17:02:41
810,auxvpt,False,None,16,'We are now free': Yazidis fleeing Isis start over in female-only commune | World news,Feminism,,https://www.theguardian.com/world/2019/feb/25/yazidis-isis-female-only-commune-jinwar-syria,661,Do they let trans women inside? ,2019-02-26 10:16:23
811,cwi327,False,None,48,That's incredibly ironic,Feminism,,https://www.salon.com/2017/12/04/alt-right-women-are-upset-that-alt-right-men-are-treating-them-terribly/,664,Lauren southern is a libertarian and not even alt right but yes that video and it’s comments are sadly hilarious. ,2019-08-28 08:52:52
812,921xms,False,[FGM],15,Somalia announces first prosecution for female genital mutilation,Feminism,,http://news.trust.org/item/20180725172417-xhmzs/,659,Yes! ,2018-07-26 12:44:44
813,8i6h6b,False,None,55,The Adorkable Misogyny of The Big Bang Theory | Pop Culture Detective,Feminism,,https://www.youtube.com/watch?v=X3-hOigoxHs,664,[removed] ,2018-05-09 14:39:01
814,ensfui,False,None,35,"Rather than taking occasional birth, medieval incels decided to kill their own sex class. Of course, their goal was to control women's bodies and sexual behaviours.",Feminism,,https://i.redd.it/s7xnicjxkea41.jpg,660,"Oh comon.. really the sole reason why people fought the vikings is because they looked and smelled better?

Lets ignore the fact that vikings were also invading / pillaging / raping everywhere they landed ",2020-01-12 19:56:52
815,2xtoq6,False,None,129,"""Let's not forget that the people who make Dove also make Axe.""",Feminism,,http://imgur.com/qlJQhbv,660,Maybe y'all are taking the ad too seriously. Not everything is meant to be hyperbole. I think it's funny tbh.  ,2015-03-03 20:18:26
816,gci173,False,None,52,Rape and Intersectional Feminism,Feminism,,https://i.redd.it/4681h9etcgw41.jpg,655,"The comment section in a nutshell (with few exceptions): 

Black feminists: white rapists should be held to the same standards as black rapists. Men who rape women should suffer some consequence as rape is a form of gendered terrorism. 

MRAs of Reddit: Black feminists are racist and we should silence them by sending a slew of misogyny with the aid of our white brethren. ",2020-05-03 01:25:53
817,etofuk,False,None,169,"When a woman speaks up about women's rights, and a guy bring up statistics about mens issues feels like the all lives matter bs again",Feminism,"Honestly a girl could speak up about something traumatic and some guys will go out of their way to say something about men falling off of roofs

Edit: It's so upsetting. I saw a girl speak up about something revolting that happened to her and then this guy thought it was the right time to express other issues about men. I support men obviously but they have to wait their turn and listen instead of literally ignoring girls and bring up things that aren't related. I forget if it was her or another person in the comments but they replied with something along the lines of ""this isn't about you right now"" bc same


Edit:

This isn't an example because I saw this in a comment section on YouTube.

But anyways in a nutshell: Girl speaks up about sexual abuse, guy comments under her comment and comments statistics about mens issues which has nothing to do with her story. That's it. It was disrespectful. Good intentions or not just inconsiderate.


Edit 2: I'm not even a feminist yet (because I want to be more educated on the topic first) but the opinions I have are what a ""liBtArD wOuLd hAvE"" and this feels like the ONLY place where I can feel accepted and not ridiculed. To the people that clearly don't like feminism, why are you here? Yes you have tHe riGht to be here but what are you expecting? For us to get owned? You guys are literally full of yourselves and can't see where women are trying to sympathise with you. Let us breathe",https://www.reddit.com/r/Feminism/comments/etofuk/when_a_woman_speaks_up_about_womens_rights_and_a/,655,[deleted] ,2020-01-25 08:46:56
818,g0gx0f,False,None,27,Male Violence against Trans Women,Feminism,,https://i.redd.it/8jipv0hmiks41.jpg,654,And TERFS are chuffed ,2020-04-13 11:09:03
819,bieqq1,False,None,22,Rape and........ . ........ .... Honour???!!!!,Feminism,,https://i.redd.it/qalsmww802v21.jpg,647,[removed] ,2019-04-28 19:08:43
820,bf2e0a,False,None,36,Female student burned to death for reporting sexual abuse,Feminism,,https://www.aljazeera.com/news/2019/04/nusrat-rafi-burnt-death-reporting-sexual-abuse-police-190419070341185.html,653,[removed] ,2019-04-19 18:16:10
821,1wl5c1,False,None,43,Rebecca West on Feminism,Feminism,,http://i.imgur.com/QyCMy8W.jpg,647,Sounds like slut shaming no? ,2014-01-30 20:52:24
822,g471a7,False,None,52,"""Jewish law is religious law based on domination over women. The point is, with both sharia courts and Jewish courts, women may not decide freely whether they exit a marriage. Like Muslim women, Jewish women often find themselves at a disadvantage in the religious divorce process.""",Feminism,,https://i.redd.it/iu9yoy4isrt41.jpg,645,"Not sure where you’re getting this information from but women in Islam are given the right to divorce if they no longer want to be in the marriage. In fact, Islamic societies have women the right to divorce centuries before western civilizations did. ",2020-04-19 12:41:01
823,1ntkoc,False,None,52,My cousin's 6 year old daughter wrote this for school,Feminism,,http://img1.ak.crunchyroll.com/i/spire4/0d2b0f53b7c1341591665d4fbdb971111381027270_full.jpg,643,[removed] ,2013-10-06 02:43:46
824,f57s5f,False,None,46,"Indian army takes 'great leap' towards equality. The Supreme Court dismissed the government's claim that women are physiologically weaker than men as a “stereotype”, the Supreme Court on Monday declared that women officers are eligible for command posts and permanent commissions",Feminism,,https://www.bbc.com/news/world-asia-india-51528141,643,[removed] ,2020-02-17 12:02:29
825,dz04dm,False,None,11,The sexual abuse of Filipina women and children by so-called ‘sex tourists' (part 1),Feminism,,https://i.redd.it/17kxplkegtz31.jpg,642,omg this is heartbreaking ,2019-11-20 10:12:43
826,92u3rn,False,[Politics],11,"House passes ""menstrual equality"" measure allowing the use of pre-tax health accounts for tampon, pad purchases",Feminism,,http://thehill.com/homenews/house/399360-house-passes-menstrual-equality-measure-for-tampon-pad-purchases-with-health,647,So much hassle to buy vital products! Just repeal the tax! ,2018-07-29 11:22:15
