,ID,is_Original,Flair,num_comments,Title,Subreddit,Body,URL,Upvotes,Comments,creation_date
311,gty0v4,False,None,122,"Regis Korchinski Paquet, another young Black woman was recently murdered by the Toronto police. One can draw interesting pictures from the facts that 40% of north American male cops are domestic abusers & Derek Chauvin's Asian wife chose the night he was in protective custody to file for divorce",Feminism,,https://i.redd.it/56k9ojund3251.jpg,1323,"To the extremely objective egalitarian trollflakes -- 

[""... the family lawyer, Knia Singh, says Korchinski-Paquet's mother does not believe her daughter was pushed, but does think police were involved with the fall to her death"". ""A lot of times when people call the police for mental health issues, it ends in death — and it shouldn't""](https://www.blogto.com/city/2020/05/regis-korchinski-paquet-protest-march-toronto/) 

The only sceptics who believe police are blameless are police themselves and their extremely egalitarian enablers. ",2020-05-31 12:12:16
312,g2fl6u,False,None,44,"To limit the spread of coronavirus, Turkey will free men who committed ""crimes against women & children, including crimes against sexual integrity, injuring women, crimes of blackmailing and threatening and publishing child pornography"",but not political prisoners, mainly journalists & politicians.",Feminism,,https://i.redd.it/i0vdhsykt6t41.jpg,1325,To be fair you’d be terrified if you were in prison right now if you were likely to get the virus. On the other hand I’m not sure if those are the right measurements to take ,2020-04-16 14:09:38
313,c88jru,False,None,224,Men and women don't have equal roles/burden in reproduction.,Feminism,,https://i.redd.it/sudoxvcfuv731.jpg,1321,Divorce settlements. ,2019-07-02 12:19:08
314,98dpbc,False,None,81,This was featured alongside famous works of art at the Carnegie Museum of Art,Feminism,,https://i.redd.it/crut1ek18wg11.jpg,1316,"I mean, who really wants see a naked man? The female figure is simply more attractive across many body types. It’s supple and nuanced in a way that the male physique is not.  ",2018-08-18 18:14:59
315,dk2tuq,False,None,71,All woman spacewalk,Feminism,,https://i.redd.it/wwpikcnfmht31.jpg,1317,[removed] ,2019-10-19 12:00:21
316,dxa16d,False,None,265,Be the CEO your parents always wanted you to Marry 👏,Feminism,,https://i.redd.it/ojlc8y7463z31.jpg,1317,[removed] ,2019-11-16 17:48:43
317,d5id55,False,None,22,Barrister in a bar,Feminism,,https://i.redd.it/v8nukm49pym31.jpg,1308,[removed] ,2019-09-17 15:11:44
318,8062zm,False,None,59,Michael Moore’s views on women,Feminism,,https://i.redd.it/7de23woudei01.jpg,1308,"Was going to post my thoughts, but posts I'm reading here already express those thoughts beautifully.

 ",2018-02-25 17:54:55
319,abir2j,False,None,43,A sign in the women’s bathroom for those who feel unsafe on a date,Feminism,,https://i.redd.it/d1jbw1u5as721.jpg,1302,[removed] ,2019-01-01 14:59:38
320,gpk644,False,None,58,"70% of the people chronic pain impacts are women. And yet, 80% of pain studies are conducted on male mice or human men. Some of the few studies to research gender differences in the experience of pain found that women tend to feel it more of the time & more intensely than men.",Feminism,,https://i.redd.it/1vgvcnfhfn051.jpg,1309,[removed] ,2020-05-24 05:29:52
321,bvlu73,False,None,128,"11-year-old Iranian girl achieves highest Mensa tested IQ score. Beating Einstein, Stephen Hawking",Feminism,,https://www.thenews.com.pk/latest/478397-11-year-old-iranian-girl-beats-einstein-and-stephen-hawking-in-mensa-iq-tests,1308,[removed] ,2019-06-01 15:15:58
322,c9x3zt,False,None,60,Menstruation Taboo,Feminism,,https://i.redd.it/oqm14qknbq831.jpg,1303,[deleted] ,2019-07-06 18:49:10
323,bmrwur,False,[Abortion rights],62,The people that need to answer these questions won’t.,Feminism,,https://i.redd.it/mybmijc768x21.jpg,1296,[removed] ,2019-05-10 01:02:26
324,g14y2i,False,None,33,Male Violence against Women,Feminism,,https://i.redd.it/bse5lhfo5ss41.jpg,1304,[deleted] ,2020-04-14 12:50:43
325,ey49at,False,None,42,Sex Worker Killed After Paroled Murderer Allowed to Satisfy 'Sexual Needs',Feminism,"In Quebec City, a sex worker was murdered by a man previously sentenced to prison for brutally killing his female partner. The man's parole officer developed a strategy for allowing him to ""meet his sexual needs"" by purchasing sex - without any concern for the sex workers' safety and despite the fact that purchasing sex is illegal in Canada. 

The parole board considered a convicted murderer's ""sexual needs"" - as if he is entitled to sex - as a matter of higher priority than the safety of the women he was visiting. They didn't even inform the women of his criminal history. To these people, women are disposable - particularly sex workers. 

 [https://vancouversun.com/opinion/columnists/daphne-bramham-allowing-paroled-murderers-to-visit-brothels-isnt-just-stupid-its-illegal-and-deadly](https://vancouversun.com/opinion/columnists/daphne-bramham-allowing-paroled-murderers-to-visit-brothels-isnt-just-stupid-its-illegal-and-deadly)",https://www.reddit.com/r/Feminism/comments/ey49at/sex_worker_killed_after_paroled_murderer_allowed/,1295,"Agreeing with everything being said above, but to go somewhat off track to discuss preventative measures for this type of thing. 

The obvious issue of how this man was being or not being supervised in the community appropriately is should be investigated which I imagine has been. But when they consider recommendations for change that they likely won't implement coz well ""she was a sex worker,"" will they actually consider enforced and improved step down approaches that include accommodation, intervention from forensic psychologist, justice program follow up, forensic risk management plans etc? Or will they over simplify it and just focus on the fact that he was allowed access to a sex worker? The issue is much more complex than that. 

Now looking at sex work side of things - if it was legal and appropriately regulated would these brothels have done a better job at protecting this girl? Would she have gone to the hotel to meet him? If the girls were well supported and they had strong policies in place and had authorities to report this man to, would it have happened? I mean, sure we can consider the parole aspect, but if he didn't have a parole officer and he was released with no parole, it still would have happened. This also needs investigating and reviewed. ",2020-02-03 08:51:48
326,a3py7s,False,None,78,Can I post memes here,Feminism,,https://i.redd.it/oq7ozfnexo221.png,1295,[removed] ,2018-12-06 17:15:19
327,hlygus,False,None,41,Just don’t ask,Feminism,,https://i.redd.it/co379h0545951.jpg,1297,[removed] ,2020-07-06 01:31:22
328,10c31r,False,None,137,Abortion,Feminism,,http://imgur.com/JrRXs,1298,[deleted] ,2012-09-23 08:16:38
329,5qhxxo,False,None,78,George R R Martin on writing women,Feminism,,http://m.imgur.com/6bB6xWr?r,1293,This changes _everything_! ,2017-01-27 16:11:20
330,bg65et,False,None,297,I think this portrays it perfectly,Feminism,,https://i.redd.it/fdi3kjst8vt21.jpg,1291,[removed] ,2019-04-22 19:20:13
331,aqmj9z,False,None,146,Countries where paid maternity leave is mandated by law,Feminism,,https://i.redd.it/z4lbl5khzjg21.jpg,1286,[removed] ,2019-02-14 17:59:53
332,adjvgf,False,None,56,New York now requires changing tables in public men's restrooms,Feminism,,https://www.cnn.com/2019/01/05/us/new-york-changing-tables-mens-bathrooms/index.html,1279,This seems like something everyone can agree is a good thing.  ,2019-01-07 17:23:50
333,ea477a,False,None,99,"This post was removed from r/unpopular opinion because it was detected as a ""feminism"" post, so I'll post it here...",Feminism,,https://i.redd.it/9mgipx0vne441.png,1280,[removed] ,2019-12-13 13:48:26
334,d1seay,False,None,69,Virginity test is a form of rape and (gender+sex+religion) based violence against women/girls.,Feminism,,https://i.redd.it/4tq0augx6ll31.jpg,1279,[removed] ,2019-09-09 15:27:29
335,dr0da9,False,None,62,So true it hurts,Feminism,,https://i.redd.it/6p2a1e2z3hw31.png,1274,[removed] ,2019-11-03 13:29:14
336,9te5tr,False,None,23,[Image] Give yourself to a cause,Feminism,,https://i.redd.it/av9bio2qtrv11.jpg,1272,[removed] ,2018-11-01 22:21:00
337,7zv3wp,False,None,20,Snake's Rights!,Feminism,,https://i.redd.it/tq8g5qzj9zh01.png,1275,"Snakes dont really have that many rights.
They have animal protective rights but women have human rights which cover a lot more.
 ",2018-02-24 07:18:24
338,axxxqr,False,None,134,The Wage Gap and Women's Choice,Feminism,,https://i.redd.it/i9wgazdvkhk21.jpg,1269,[deleted] ,2019-03-06 11:45:32
339,cb139e,False,None,47,Sex should be a mutually pleasurable experience,Feminism,,https://i.pinimg.com/originals/fc/f6/03/fcf6033e100f21c38027ab3f67f920e9.jpg,1269,"Idk, male sexuality often seems to me like a mad struggle for performance, wether he „achieved her orgasm“ or not, trying to distract himself with unrelated thoughts just to „last another minute“.Its so tense and disconnected. Its like trying to not show any weakness when youre supposed to be vulnerable. ",2019-07-09 13:46:41
340,bb8oig,False,None,174,"Good point, well made!",Feminism,,https://i.redd.it/rwlztxcb29r21.jpg,1268,[removed] ,2019-04-09 14:36:11
341,brb76t,False,None,94,"Not sure if this has been shared here before, so if it was, do feel free to tell me. Source in comments.",Feminism,,https://i.redd.it/b3o4gy1wmiz21.jpg,1266,Does society suddenly not want people to produce? Why would there be a problem with men (or anyone) being potent? I'm confused as I assume this is about abortion but it doesn't make sense as taking away peoples ability to make children shouldn't have anything to do with the discussion about the morality of abortion. If I'm misinterpreting this post lmk ,2019-05-21 14:39:14
342,bkjmzr,False,[Trigger Warning],114,"Rape by deception is a crime in which the perpetrator has the victim's agreement and compliance, but gains it through deception or fraudulent statements or actions. It is not addressed in the laws of sexual assault in many countries. It should be made illegal worldwide. This is not normal.",Feminism,,https://i.redd.it/f7mkmi9946w21.jpg,1261,[deleted] ,2019-05-04 10:02:24
343,bj7elc,False,None,170,Feminism and Atheism,Feminism,,https://i.redd.it/xipvi93qcgv21.jpg,1261,[deleted] ,2019-04-30 19:23:36
344,fk61cr,False,None,25,Trapped at home: Coronavirus could be disastrous for domestic violence victims,Feminism,,https://www.latimes.com/entertainment-arts/story/2020-03-16/social-distancing-coronavirus-domestic-violence,1254,I work as an advocate at a DV/SA shelter and that is my nightmare right now. ,2020-03-17 14:20:20
345,dv86no,False,None,26,Young Mathematician,Feminism,,https://i.redd.it/9cebfpvnf8y31.jpg,1254,WHO RUN THE WORLD? ,2019-11-12 10:27:02
346,cq8bq8,False,None,34,"In India, thousands of lowcaste women have banded together to become vigilantes. They’re doing what the courts and police can’t: holding men accountable",Feminism,,https://story.californiasunday.com/the-green-gang,1249,[removed] ,2019-08-14 11:24:29
347,6xkpj1,False,None,43,Boys who like girls don't show it in a violent or mean manner,Feminism,,https://i.imgur.com/XtgNShW.jpg,1254,[removed] ,2017-09-02 08:48:08
348,aet4cz,False,None,177,If anti-abortion/contraception logic was applied to men.,Feminism,,https://i.redd.it/iwtrrnd31r921.jpg,1250,[deleted] ,2019-01-11 07:47:03
349,gqzlx3,False,None,123,I'm tired of being a Feminist...,Feminism,"Ever since integrating into the world as an independent adult, I've identified as a feminist. 
I've learned a bit about feminism growing up, but it wasn't until I began entering the world as my own, individual person, that I ever felt much of a connection to this so-called 'feminism'.

But then, I grew up. 
I entered the real world. 
I learned of injustices ranging from severe human rights violations, down to subtle differences in social acknowledgment.

I began hearing of atrocities happening around the world, while also becoming more and more aware of when people treat me differently than a male counterpart.

And, to be honest? I'm tired.
I'm tired of explaining why that joke just isn't funny.
I'm tired of explaining why his advances are inappropriate.
I'm tired of explaining why progress doesn't negate the fact that there's still work to be done.
I'm tired of keeping my composure during someone's inappropriate behavior.
I'm tired of justifying why bodily autonomy is so important to me.
I'm tired of holding my tongue while his eyes slide over my body, as if I'm a piece of meat being considered in a market.

I'm tired of explaining that, no, feminism isn't about hating men.
I'm tired of breaking down the need for feminism to someone who has no interest in actually hearing them.
I'm tired of having to demonstrate that feminists care about issues involving men as well. 
I'm tired of having to prove why my experience does, in fact, matter.


I want to scream-
How do you know? 
Why don't you care? 
How can you justify that? 
What do you feel that you are owed by us?

I'm just... tired.

But I see all the feminists of today, keeping their composure and continuing the fight, day after day. 
So, I'll continue explaining, educating, and gently correcting.

But I still wonder to myself....
How aren't you tired?",https://www.reddit.com/r/Feminism/comments/gqzlx3/im_tired_of_being_a_feminist/,1253,[removed] ,2020-05-26 15:53:35
350,b4xp4o,False,None,33,Sexual Assault and Witch Hunt,Feminism,,https://i.redd.it/t3w6i70g73o21.jpg,1248,[removed] ,2019-03-24 15:41:51
351,9jvezc,False,[Quotes/Posters] [Sexuality] [Movies/TV],45,Austin frikken Powers,Feminism,,https://i.imgur.com/nKKG9F6.jpg,1251,"Okay, c’mon. He’s a movie character so “most sexed up man in all of history” is ridiculous. There is no point here.  ",2018-09-29 10:10:19
352,crpzhw,False,None,240,Neurosexism.,Feminism,,https://i.redd.it/lteijhgsy1h31.jpg,1242,"Sample size dosent matter, if were all wired the Same then there wouldn't be any difference. 10 people wouldn't be any different than 10000. ",2019-08-17 18:31:39
353,e00j14,False,None,87,BDSM and Male violence against women,Feminism,,https://i.redd.it/liayom42i8041.jpg,1246,[removed] ,2019-11-22 12:48:45
354,93huzx,False,None,146,Feminism is for everybody,Feminism,,https://i.redd.it/wc5mk6mgacd11.jpg,1238,[removed] ,2018-07-31 20:00:29
355,7uxt7a,False,[Satire/Humor],135,How it sometimes feels to subscribe to this sub,Feminism,,https://i.redd.it/5kmoi3eg1yd01.jpg,1237,[removed] ,2018-02-03 06:40:23
356,eiqfqt,False,None,155,"Capitalism, not women, not diversity, killed gaming",Feminism,,https://i.redd.it/w8ljko61z4841.jpg,1243,[deleted] ,2020-01-02 00:33:52
357,epr3xs,False,None,69,"""Inevitably, I get some snide remark like ""well, that's not a fair representation,"" and I can only smh. Dude, the real world doesn't hold up to your sexist bullshit, the fictional ones don't stand a chance"".",Feminism,,https://i.redd.it/juahr08hz7b41.jpg,1235,This is the dumbest thing I've seen on this sub. I have literally no idea what this sub is any more. ,2020-01-16 22:50:09
358,dacpfq,False,None,99,What these lunatics have to say about rape,Feminism,,https://i.redd.it/wq7glvzfc4p31.jpg,1234,[removed] ,2019-09-28 06:58:19
359,c0uum9,False,None,52,"Hundreds of thousands Swiss women went on strike to demand equal pay, greater equality and more respect!",Feminism,,https://i.redd.it/hqa6uxc5xe431.jpg,1237,[removed] ,2019-06-15 07:39:28
360,f2h3zb,False,None,29,Women in Science,Feminism,,https://i.redd.it/wlrdo0m7odg41.jpg,1230,"I feel this might be out of place, but does it shock anyone that this happened regularly back in these times? Most of the scientific breakthroughs were discovered by women. And instead of us being mad and feeling sorry for her why dont we push to change the history books? ",2020-02-11 23:18:16
361,hnjxrr,False,None,48,The Frequent Problem With ‘Dark Humor’,Feminism,,https://i.redd.it/9dyhiplkgj951.jpg,1227,"""Dark humour"" is just a poorly veiled excuse to feign hatred and pestilential feedback on humans or things. Even if you attempt to interpret their ""humour"" with substantial generosity, it is impossible to find a comical aspect or an underlying witty remark about the subject in question. 

Dark humour is egregious and appalling and it adequately reflects how most of the humans would be if their actions had no consequences. ",2020-07-08 16:15:02
362,c3sd88,False,None,67,A woman's place!,Feminism,,https://i.redd.it/aehktr2mfw531.png,1222,[removed] ,2019-06-22 17:25:22
363,ciw6bz,False,None,366,"Stop Saying ""Females"" When You're Talking About *Women*",Feminism,,https://jezebel.com/the-problem-with-calling-women-females-1683808274,1230,Stop calling it toxic masculinity when you’re talking about *bad meninism* ,2019-07-28 14:04:01
364,e0zkml,False,None,12,Women in Science,Feminism,,https://i.redd.it/xi2gqrthgn041.jpg,1224,Awesome! ,2019-11-24 15:06:43
365,d6wtti,False,None,197,am i the only one tired of seeing these “girls vs boys” memes? boys are always laughing about girls claiming they are unique and special when they are doing the same thing but against girls and not other boys?,Feminism,,https://i.redd.it/u58kcg8fsen31.jpg,1219,[removed] ,2019-09-20 15:49:33
366,5f595s,False,[Quotes/Posters],23,Feminist graffiti from the 1970's (xpost /r/OldSchoolCool),Feminism,,https://i.reddituploads.com/51e391b93a164e8599566d83cb0e7ce3?fit=max&h=1536&w=1536&s=e16d5ee507cfecad1cd8f2c7ce88fea3,1221,[removed] ,2016-11-27 13:17:26
367,ag82ra,False,None,27,How to shut down sexist people who stigmatise breasts,Feminism,,https://i.redd.it/a26hi2vt0la21.jpg,1215,[removed] ,2019-01-15 12:38:59
368,d0qsta,False,None,42,"Rape, Self Defense and Rape Culture (Part 3)",Feminism,,https://i.redd.it/oh3sgbbr83l31.jpg,1220,[removed] ,2019-09-07 03:05:40
369,akdzuu,False,None,27,Abusers protect abusers,Feminism,,https://i.redd.it/t2goxmnskyc21.png,1215,"*Image Transcription: Twitter Post*

---

> **terry crews**, @terrycrews
>
> @RealDLHughley
>
> I have looked up to you my whole career as one of the funniest most talented 
> 
> people I've ever seen.
>
> I remember when I saw you warming up the crowd at FRESH PRINCE OF BEL
> 
> AIR and i thought ""this man is a genius""
 
>**terry crews**, @terrycrews
>
> But now you are an example of when comedy turns to sarcasm and cynicism.
> 
> And you find it extremely easy to get jokes at someone else [sic] expense. You
> 
> mock my success, but all I ever did was support you.

> **terry crews**, @terrycrews
>
> You @50cent @unclerush and @tariqnasheed have decided my sexual assault 
>
> was hilarious, wheras there are a whole generation of black women and men
> who don't think it's funny.
>
> ABUSERS PROTECT ABUSERS but the MOCK SURVIVORS as well.
>
>When you see me, keep it moving.
---

^^I'm&#32;a&#32;human&#32;volunteer&#32;content&#32;transcriber&#32;for&#32;Reddit&#32;and&#32;you&#32;could&#32;be&#32;too!&#32;[If&#32;&#32;you'd&#32;like&#32;more&#32;information&#32;on&#32;what&#32;we&#32;do&#32;and&#32;why&#32;we&#32;do&#32;it,&#32;click&#32;here!](https://www.reddit.com/r/TranscribersOfReddit/wiki/index) ",2019-01-27 17:18:05
370,dxnhr3,False,None,98,"You don’t say, there might be problems with Christianity?",Feminism,,https://i.pinimg.com/564x/17/7f/f2/177ff2a21716afa9ff746e127401e36f.jpg,1215,"Pardon me, but before you want to attack other people's private beliefs and religious views, maybe check your facts first. This is not even in the Bible! ",2019-11-17 15:00:08
371,9zqmxw,False,None,45,A pillow I made for my friend,Feminism,,https://i.redd.it/j5a6j9eyb3021.jpg,1209,"Very nice work!
I'm sorry I'm a bit clueless here.. After the fall of the patriarchy what is meant to replace it?  ",2018-11-23 18:20:28
372,ha3yf7,False,None,20,"The Egyptian military regime arrested her for raising the rainbow flag & subjected her to physical+sexual+psychological torture for being gay for 3 months that caused her to suffer PTSD & several suicide attempts, an exile in Canada for fear of rearrest.",Feminism,,https://i.redd.it/jwp7wt8f13551.jpg,1206,What did she honestly think was going to happen? ,2020-06-16 13:25:50
373,9lyvek,False,None,119,Fixed it! That’s better!,Feminism,,https://i.redd.it/zxypy50kcmq11.jpg,1198,[deleted] ,2018-10-06 19:43:48
374,ffapr7,False,None,25,"Iranian lawyer who defended women’s right to remove hijab gets 38 years, 148 lashes.",Feminism,,https://womenintheworld.com/2019/03/11/iranian-lawyer-who-defended-womens-right-to-remove-hijab-gets-38-years-148-lashes/?fbclid=IwAR2_ETSMoalu5qnQYTIbvUwki_vVttJQbco2rYL2sP2Ez9nRR6NZQ6LbG08,1205,I wish something like this would happen to White women in America just so they’d be grateful for what they have for change. ,2020-03-08 10:15:00
375,f4843w,False,None,97,Nothing as obnoxious as white men and the White Heteropatriarchy acting like victims when their ill-gotten privileges are challenged.,Feminism,,https://i.redd.it/4nztm0dyacc41.jpg,1202,[deleted] ,2020-02-15 11:16:08
376,aefcat,False,None,61,Irrational obsession with virginity (a mythical conception). Proper sex education will be able to cure this unhealthy obsession.,Feminism,,https://i.redd.it/6y8s6xu3ui921.jpg,1200,"Men will not leave women alone, they persist on claiming them after death, isn't that what the whole institution of marriage boils down to, perpetual claim over a women, her memory and history. Shouldn't women be allowed a do over after they've died and be de-linked from the men, namely the husband(s), who claimed them in life? ",2019-01-10 04:13:39
377,fgypem,False,None,46,Harvey Weinstein Sentenced to 23 Years in Prison on Rape Charges,Feminism,,https://www.7ummitmagazine.com/latest-news/2020/3/11/harvey-weinstein-sentenced-to-23-years-in-prison-on-rape-charges,1199,[removed] ,2020-03-11 15:15:47
378,earjnn,False,None,104,"/r/BlackPeopleTwitter cruelly mocking a woman for her natural looks. I messaged the mods saying that people have killed themselves over less, they acknowledged it but didn't delete the post. The casual misogyny over there is disgusting.",Feminism,,https://i.imgur.com/fLs9bUy.jpg,1202,[removed] ,2019-12-15 00:05:06
379,d2qh1h,False,None,34,Reproductive rights in India,Feminism,,https://i.redd.it/f7hek6xbzyl31.jpg,1191,[deleted] ,2019-09-11 13:49:54
380,9cd01v,False,None,169,"Respect Ariana, Respect ALL WOMEN",Feminism,,https://i.redd.it/zb6m5y4tguj11.jpg,1192,[deleted] ,2018-09-02 15:45:18
381,cjr03v,False,None,235,"""They are not victims, they are heirs.""",Feminism,,https://i.redd.it/c57n39xqofd31.jpg,1190,[removed] ,2019-07-30 12:23:36
382,8aciiw,False,None,229,"""Nothing really offends me,"" brags the white man",Feminism,,https://i.redd.it/ipr1kckgecq01.png,1187,[removed] ,2018-04-06 19:49:00
383,g1rl0a,False,None,56,Polish lawmakers are using the COVID-19 pandemic to push through unpopular legislation that would impose a ban on abortion and criminalise sex education in schools.,Feminism,,https://i.redd.it/u0hvt62tdzs41.jpg,1181,"I'm from Poland and in my opinion this is more of a political decision than everyone thinks. When the government is obligated to vote in a particular project and if there is no consensus, the project is delayed. It's a very delicate subject for government because if they vote against this pro-life project, they can lose votes, because most of the people that vote for them are elderly and conservative. (We have election in may) This project is considered in government for 5 years and still no definite decision was made. So probably this time, no decisions will be made. Again ",2020-04-15 13:08:45
384,8ujmo3,False,None,34,r/Feminism now has 100K users! Thank you to everyone who makes this a great feminist space!,Feminism,,https://media.giphy.com/media/2AMxY3glvUN8Y/giphy.gif,1182,[removed] ,2018-06-28 13:55:11
385,fuvjr1,False,None,120,Women and Ageing,Feminism,,https://i.redd.it/lmgms5iiktq41.jpg,1181,[removed] ,2020-04-04 15:27:23
386,bk1t7r,False,None,22,"Women from India, Japan, and Syria who completed their education as physicians in Philadelphia, 1885.",Feminism,,https://i.redd.it/uzt6h33pkuv21.jpg,1182,[deleted] ,2019-05-02 23:43:21
387,a15a8e,False,None,70,Not O/C but my girlfriend told me to post it,Feminism,,https://i.redd.it/lt5lfvyh12121.jpg,1185,[removed] ,2018-11-28 11:11:40
388,fqmic7,False,None,46,"Turkey would allow around 100,000 of the country’s 300,000 prisoners to walk free. Men convicted of sexual assault, gendered violence would be released, but political prisoners, terrorists & murderers would not be released. Political prisoners, & not perpetrators of gendered terrorism,should be free",Feminism,,https://i.redd.it/d4ufb2yvofp41.jpg,1183,[removed] ,2020-03-28 15:42:52
389,fgffdc,False,None,36,"Painful menstruation is not a public health priority, according to male centric medical community.",Feminism,,https://i.redd.it/7xj664qg4vl41.jpg,1183,Annenizi sikeyim orospu çocukları ,2020-03-10 15:20:21
390,agrbdm,False,None,174,Who's the real snowflake?,Feminism,,https://i.redd.it/st9i3p83dva21.jpg,1178,Ewww feminism  ,2019-01-16 23:25:30
391,9291ly,False,[Satire/Humor],99,“Behind every woke dude there are 50 burnt out feminists”,Feminism,,https://i.redd.it/uzxjyg9itec11.jpg,1185,[removed] ,2018-07-27 03:26:42
392,fpu5sf,False,None,69,Invisible labor,Feminism,,https://i.redd.it/rw0qdbc3m1p41.png,1180,[removed] ,2020-03-27 09:44:29
393,dbclf2,False,None,125,This is absurd,Feminism,,https://i.imgur.com/aypTbUI.jpg,1176,Ffs listen my best friend and I kept getting interrupted at Harry Potter trivia and I assure you we were highly intense. ,2019-09-30 14:45:21
